Type,News
Real,"Says Dan Patrick has ""called immigration into Texas an invasion"" and ""said immigrants coming into Texas bring third-world diseases."""
Real,"In 2008, ""only 54 percent of Latinos in Texas were registered to vote and only 35 percent actually turned out."""
Real,"Even after Obamacare is fully implemented, there still will be tens of millions of people not covered."
Real,We have about six school districts that are in school 140 to 150 days this year.
Real,Says Ron Paul doesnt believe in marriage licenses.
Real,"Louie Gohmert of Texas ""compared the current general-in-charge in Egypt to George Washington."""
Real,"Mitt Romney ""drove to Canada with the family dog Seamus strapped to the roof of the car."""
Real,"Texas ""ranks third in teen pregnancies... and it is No. 1 in repeat teen pregnancies."""
Real,A congressional laundry closed due to the partial government shutdown.
Real,Says he's signed a pledge not to raise taxes four times.
Real,"New Jersey has had ""seven credit downgrades"" since Chris Christie became governor."
Real,"Between 1980 and 2010, water usage in Georgia dropped even as the states population grew."
Real,"There are ""a larger number of shark attacks in Florida than there are cases of voter fraud."""
Real,The transportation sales tax would cost the average consumer an estimated $112 a year.
Real,The House of Representatives does not have a prochoice majority.
Real,Ninety percent of Texans say they do not want the nursing homes to close. It polls higher than anything else.
Real,"Floridas proposed amendment for medical marijuana would allow ""people who alleged minor ailments such as muscle spasms, neck pain, back pain and even menstrual cramps (to qualify) for government-sanctioned pot-smoking."""
Real,"Barack Obama ""refuses to acknowledge Jerusalem as the capital of Israel."""
Real,One out of every two kids who are graduating college right now can't find a job.
Real,"Almost 88,000 United States service members are still missing and unaccounted for, dating back to World War II."
Real,"The ""average taxpayer will see the equivalent of a 2 percent pay raise as a result of low fuel prices."""
Real,We have more women living in poverty in this state than almost anywhere else.
Real,"Florida is ""second in the nation in the uninsured."""
Real,"Crimea became part of Ukraine only in 1954. Crimea was historically part of Russia, and (Nikita) Khrushchev gave it to Ukraine in a gesture that mystified some people."
Real,The recently passed transportation funding bill is a billion-dollar tax increase for Georgians.
Real,"As mayor, [Allan Fung] raised taxes three times."
Real,There have been at least 100 shootings each year [Angel Taveras] has been mayor of Providence.
Real,Sixteen million jobs were created under Ronald Reagan's presidency.
Real,"In 1992, Mitt Romney ""gave money to Democrats for Congress."""
Real,There are 86 languages spoken at Miami Dade College.
Real,The right-to-work states are creating a lot more jobs today than the heavily unionized states.
Real,"Says ""some [states] with the largest reductions in crime have also lowered their prison population."""
Real,"Since World War II, only Gerald Ford and Bill Clinton have had worse ratings after seven months than President Obama."
Real,(Obamacare) is a bill which has never once had a majority of Americans favor it.
Real,"Obama's secretary of energy, Dr. Steven Chu, ""has said publicly he wants us to pay European levels (for gasoline), and that would be $9 or $10 a gallon."""
Real,"We balanced the budget with the 1997 Balanced Budget Act, and ultimately had four consecutive balanced budgets."
Real,"The EPA was asked about an environmental citation for the city landfill in Nashua, N.H. but ""didnt know"" why it was cited."
Real,"On the day of the New Hampshire primary in 1980, the top 13 people of Ronald Reagans staff quit."
Real,"Every 10th dollar spent by the Social Security Administration on its program for the poor is ""waste, or fraud, they cant validate that the people should have gotten it,"" totaling about $8 billion a year."
Real,"In every committee when the health care bill was considered, Democrats voted against an amendment that would require members of Congress and their staff to take the government-run public option as their health care plan."
Real,Legislation being considered in Texas would strip the salaries and pensions of clerks who issue marriage licenses to same-sex couples  even if the Supreme Court strikes down Texas marriage ban later this year.
Real,"Milwaukee is ""the most segregated city in America."""
Real,"Says Vladimir Putin once said, ""The breakup of the Soviet Union was the greatest geopolitical tragedy of the 20th century."""
Real,"Wisconsins state budget is almost twice as large per person as the state budget of Texas, and even after billions in tax cuts, Wisconsins working families and businesses remain subject to a heavy tax burden."
Real,"Following the 2009 session, Texas House Speaker Joe Straus ""was acknowledged and thanked for his tireless efforts by Planned Parenthood, the nations premier abortion provider."""
Real,"Polls show that Americans ""overwhelmingly"" support ""expanding background checks."""
Real,"In New Hampshire, 93 percent of Democrats, 79 percent of Republicans, 82 percent of gun owners and 60 percent of NRA households support background checks."
Real,"Says Mitt Romney ""was director of a company that stole millions from Medicare."""
Real,Pasco County has the second highest population of homeless in all of Florida.
Real,"About 40 percent of U.S. illegal immigrants ""came in on an airplane, with a legal visa, and just overstayed their visa and have never gone home."""
Real,"Says Chris Christie ""inherited the highest taxes in America and the worst unemployment in the region."""
Real,"Gov. Lawton Chiles said ""if I were to become ... become speaker of the House it would be (his) worst nightmare."""
Real,(I) helped to invent a system that saved over a billion dollars on welfare.
Real,"Republican candidate for governor Allan Fung ""donated to Democrats like Congressman David Cicilline, disgraced (House) speaker Gordon Fox and even Mr. Obamacare, Harry Reid."""
Real,"More than 9,000 Rhode Island voters used the Moderate Party master lever mechanism and they didn't have a single Moderate on their ballot."
Real,"Eleven states complete their [legislative] sessions within three calendar months, and another five only meet biennially."
Real,"Food stamp spending ""doubled under President Bush, doubled again under President Obama."""
Real,"Says about NSA data collection: ""Every member in both parties who served on the Intelligence Committee voted in favor of this."""
Real,"The national economic recovery has led to higher than expected tax revenues and projected budget surpluses in nearly every state in the nation, including Wisconsin."
Real,"A ""majority in every state favors path to citizenship for undocumented immigrants."""
Real,"The region I represent, both currently and in the future, has more automotive plants than the entire state of California."
Real,The poorest in this country are women.
Real,Creeping defense commitments in (the Middle East) and globally now consume over half the U.S. discretionary budget annually.
Real,"Electric utility FirstEnergy's annual revenues are greater ""than the GDP of Haiti, Kyrgyzstan, Iceland, or 15 African nations."""
Real,States have cumulatively cut over $1.8 billion from their mental health services between 2009 and 2011. This is the largest reduction in state mental health services in half a century.
Real,Says Lake Erie contains more native fish than all the other Great Lakes combined.
Real,"Last year, Korea sold nearly half a million cars in our country. ... The United States, you know how much we sell to them? Six thousand. What kind of deal is that?"
Real,A gallon (of gasoline) delivered to the front lines for our troops in Afghanistan cost more than $400.
Real,"In Massachusetts, Scott Brown's Republican affiliation is ""not a secret, but clearly not on display."""
Real,"In Rhode Island, 28 percent of adults released from state prisons are re-incarcerated within a year."
Real,Twenty percent of housing in Portlands Pearl District is affordable.
Real,"Sharron Angle ""would eliminate the Department of Education."""
Real,"Since 1981, reconciliation has been used 21 times. Most of it's been used by Republicans."
Real,"Congress used earmarks ""for more than 200 years."""
Real,"The Koch brothers are ""the richest people in the world. Individually, they're only fifth. Put them together they're the richest in the world."""
Real,"In the history of the United States, 168 presidential nominees have been filibustered, 82 blocked under President Obama, 86 blocked under all the other presidents."
Real,President Obama has declared disasters in 48 of 50 states this year.
Real,Sharron Angle voted to protect sex offenders.
Real,Issue 2 makes it illegal for us to negotiate for enough firefighters to do the job.
Real,Hobby Lobby provided this (birth control) coverage before they decided to drop it to file suit.
Real,Providence graduation rates are up.
Real,"Providence teachers ""can go five or six years without an evaluation."""
Real,If our recovery were more typical of the postwar era . . . we would have 14 million more jobs today.
Real,"When I became president and CEO of Godfathers Pizza, it was supposed to go bankrupt . . . We turned it around with common-sense business principles."
Real,"The U.S. has ""47 million people on food stamps. Thats 14 million more than when the current occupant of the White House took over."""
Real,"For the second quarter in a row, my campaign has raised more money than any other challenger in the nation and brought our fundraising total to over $800,000."
Real,"Says President Obama ""has fired more cruise missiles than all other Peace Prize winners combined."""
Real,In 2010 about 75 percent of child abuse and neglect reports in Oregon were made by those required to report by law.
Real,"Milwaukee has seen ""an uptick in violence"" since 2010, and ""the only period of calm we get is when winter sets in."""
Real,"A ""working woman"" will earn $7.70 on $10."
Real,"A DeKalb sewer project ""will create up to 4,000 direct jobs per year at peak production, many of which will be set aside exclusively for DeKalb residents."""
Real,"Last year, ""we saw the first reduction in the federal prison population in 32 years."""
Real,"After filing a lawsuit in Rhode Island, we reached an agreement with state agencies that resulted in more voters being registered in the first full month after our lawsuit than in the entire previous two-year reporting period."
Real,"Says recent studies indicate that nationally, only 8 percent of white voting-age citizens but 25 percent of African-American voting-age citizens lack government-issued photo IDs."
Real,"Texas prosecutor Rosemary Lehmberg purchased ""72 bottles of vodka in just one store alone, in just over a year."""
Real,Seven of the 10 highest-income counties in the country ring the city of Washington D.C.
Real,Says 1 in 7 American families is on food stamps.
Real,"Obama ""said (the individual mandate) wasn't a tax."""
Real,Says she condemned violence at a campaign stop in Arizona in March.
Real,We spend three times more on entitlements and debt services than we do on defense.
Real,"President Obama's proposal calls for serious cuts in our own long-term carbon emissions, but China and India will still be allowed to increase their emissions."
Real,"Obama has admitted a cap and trade plan would cause electricity bills to ""skyrocket."""
Real,Barack Obama ... 96 percent of his votes have been solely along party line.
Real,You ... said that Barack Obama was not ready to be commander in chief.
Real,That luxury jet was over the top. I put it on eBay.
Real,"Senate Majority Leader Harry Reid ""said, quote, 'I can't stand John McCain.' """
Real,"As governor, I've stood up to ... the big oil companies."
Real,"When oil and gas prices sent state revenues up, Palin sent ""a large share of that revenue directly back to the people of Alaska."""
Real,Americans now spend 100 days out of the year working for government before we even start working for ourselves.
Real,"The proposed excise tax on ""Cadillac"" health plans will hit ""those making less than $200,000"" the hardest."
Real,The Defense Department received only one-half of 1 percent of the nearly trillion-dollar stimulus package funding.
Real,"Job losses are so certain under this new cap-and-tax plan that it includes a provision accommodating newly unemployed workers from the resulting dried-up energy sector, to the tune of $4.2 billion over eight years. So much for creating jobs."
Real,Obama held one of the first meetings of his political career in Bill Ayers's home. And they've worked together on various projects in Chicago.
Real,"Sarah Palin was repeating ""Abraham Lincoln's words"" in discussing the war in Iraq."
Real,Georgia has recovered more than $60 million that was lost to Medicaid fraud
Real,Most voters prefer zombies to the current U.S. Congress.
Real,Bob Barr has changed his position on the Defense of Marriage Act over the years.
Real,Georgia has some of the highest gas taxes in the Southeast but one of the lowest taxes on gasoline for transportation in the nation.
Real,"As governor, [Mitt Romney] balanced the budget without raising taxes and created jobs."
Real,"Only 20 colleges and universities ""have athletic departments with revenue exceeding expenses."""
Real,"Says budget savings by reducing pay and benefits for federal employees total $103 billion over 10 years -- more than $50,000 per worker."
Real,American oil production is at its highest level since 2003.
Real,"We have a system now where in 40 states, the highest-paid public employee is the state universitys head football or basketball coach."
Real,"Says Virginia, Florida and Georgia are the three states that are the principal source for gun trafficking."
Real,"According to ATF data, 70 percent of firearms recovered and traced in drug cartel crimes in Mexico originated from the United States."
Real,The U.S. gun homicide rate is 20 times the combined rate of other western nations.
Real,"Over the past decade, the big five oil companies --- BP, Chevron, ConocoPhillips, ExxonMobil and Shell -- made a total profit of nearly $1 trillion."
Real,"The Bush-era tax cuts failed to increase employment and ""work-force participation fell in 2001 and has never returned to the record level set in 2000."""
Real,Fulton County has successfully reduced the number of pregnancies among 15- to 19-year-olds.
Real,"The judicial system is the most underfunded in this state, able to only pay 52 percent of its obligations. Meanwhile, judges get some of the richest pensions of all public employees."
Real,CBO reports that delaying the Obamacare individual mandate will reduce the deficit by $35 billion over ten years.
Real,[E]xcise tax increases drive commerce across state lines.
Real,"Worldwide credit card transactions, the credit card fraud rate is 0.04 percent, compared to almost 8 percent, 9 percent, 10 percent of Medicare fraud."
Real,The fastest-growing part of the Pentagons budget are health care expenses.
Real,Connecticut's take on slot machines is 25 cents on the dollar. And the state's take on table games: zero.
Real,"Seneca Jones Timber Co., aiming to increase logging and allay fears that old growth will be cut, says mills have shifted to second-generation trees. An ad from the company asks: ""Do you know that most all mills in Oregon have retooled over the past 20 years?"""
Real,"Ohio today has the ""fewest number of state employees since the Reagan administration."""
Real,The first professional baseball team was from an Ohio city.
Real,Education Week rates Ohio schools in the top five in the nation.
Real,Congress can tell [the Supreme Court] which cases they ought to hear. We have that authority.
Real,"The Employee Free Choice Act mandates the ""elimination of the secret ballot."""
Real,"Turkeys today weigh 29.8 pounds. In the 30s, they weighed 13.2 pounds."
Real,"There are ""approximately 20,000 annual gun purchases in Rhode Island."""
Real,"Of all cities in the United States with more than 100,000 people, Providence is the 183rd safest."
Real,Says states that passed anti-illegal-immigrant legislation also had few Hispanic legislators.
Real,The U.S. Supreme Court decided in 1982 that non-citizen children must get free K-12 education.
Real,"At present spending levels, only citizens of New York have a greater local debt burden than Texans."
Real,The Texas Department of Transportation... misplaced a billion dollars.
Real,Fourteen million Americans' mortgages are greater than the value of their homes.
Real,"The top 10 most well-paid CEOs in America received a combined $770 million in 2010, while the average American workers wage rose just 2 percent."
Real,"The Fed created $1.2 trillion out of nothing, gave it to banks, and some of them foreign banks, so that they could stabilize their operations."
Real,Seventy of Ohio's 88 counties now have more than 25 percent of their residents eligible for emergency food.
Real,"The Bush tax cuts ""helped to create a substantial part of the deficit."""
Real,"Says none of the government programs targeted for elimination or severe cutback in House Republican spending plans ""appeared on the GAO's list of government programs at high risk of waste, fraud and abuse."""
Real,One of the biggest causes of our soaring debt and economic insecurity ends up being Pentagon spending. The budget for the Pentagon consumes more than half of our discretionary spending.
Real,The War in Afghanistan is officially the longest war Americans have ever been asked to endure.
Real,"Well, you know, the Teamsters wanted to drill in Alaska. I voted against drilling in Alaska. So it's not like I'm a slam dunk on every issue."
Real,Social Security ... is solid through about 2040 without any changes whatsoever.
Real,"Thirty-four percent of Hispanics don't have any health care at all, don't have any health insurance."
Real,"Says the tax code is effectively subsidizing ""the marketing efforts of fast food and junk food companies by as much as $19 billion over 10 years."""
Real,About 57 percent of registered Democrats in the new (9th Congressional) district come from my old district.
Real,Social Security didnt cause the debt crisis. Social Security had nothing to do with the debt crisis.
Real,"Says that before health care reform, one of every three health care dollars spent -- more than $800 billion a year -- didn't go for health care."
Real,"The Great Lakes Compact has a loophole. And the loophole is that while you cannot remove the water in a big transport, you can remove it in containers of 5.7 gallons or less."
Real,"I'm the first person who really took up the issue of the war. Four years ago I said that there was no proof that Iraq had weapons of mass destruction, and, actually... did an analysis which disproved the cause for the war."
Real,"From a standpoint of the county government, neither school system has received an increase in funding over the past six years."
Real,"A tax plan promoted by North Carolina Senate candidate Thom Tillis will ""overwhelmingly benefit the wealthy."""
Real,"North Carolina Republican Senate candidate Thom Tillis would let insurance companies ""deny coverage for pre-existing conditions."""
Real,We are amassing most of our military strength in a country where fewer than 100 members of al Qaeda remain.
Real,The governor having a meeting ... isn't covered by the open meetings act.
Real,"There are cities and counties in Georgia that dont have websites, and where elected officials dont have email addresses."
Real,"Says opponents of the health care law ""prevailed on our two main arguments"" to the U.S. Supreme Court."
Real,A white family is likely to have about six times as much wealth than a black or Hispanic family coming out of the recession.
Real,"The federal government owns 30 percent of the land in the 50 states, or about 650 million acres."
Real,I am a candidate. I have not withdrawn.
Real,Three courts have found the new health care law constitutional and two have found it unconstitutional.
Real,"Since 1990, in inflation-adjusted dollars, per-student funding of the (Florida) state university system from general revenue has dropped by about $4,000."
Real,"AIG has fully repaid the federal government ""plus a profit of more than $22 billion."""
Real,Texas families have kept more than $10 billion in their family budgets since we successfully fought to restore Texas' sales tax deduction a decade ago.
Real,"Over 80 percent of our trade deficit today is with countries that are not trade agreement partners, that are not level playing fields for the United States."
Real,"The poverty level in the Dallas school district ""is one of the highest in the country, higher than New York, Chicago, Los Angeles, Houston, Detroit and Newark."""
Real,"Of six Rhode Island tax-credit programs worth about $35 million, ""three companies got 90 percent of that -- CVS and two companies not even located in the state of Rhode Island."""
Real,"Rhode Island spends ""52 percent more per capita on human service programs than the national average."""
Real,"If we choose Obamacare expansion, 600,000 will lose eligibility for their subsidies, of which 257,000 would be forced into Medicaid."
Real,"We have dozens of districts that go for 150 to 200 miles, splitting counties, splintering cities and connecting areas that have very little in common."
Real,My campaign alone has created more jobs in the state of Rhode Island than Narragansett Beer.
Real,The budget I managed at the Department of Education was more than $60 million.
Real,"Says the 2010-11 New Hampshire budget ended with an $18 million surplus, while the Republican-led 2012-13 budget has a $40 million deficit."
Real,"Says Jennifer Horn, chairwoman of the N.H. Republican Party, owes $92,000 in back taxes."
Real,Mitt Romney is the first Massachusetts politician to run for president and not win the New Hampshire primary in a generation.
Real,"John McCain ""voted against the tax cuts of 2001 and 2003, wrongly claiming they helped only the rich."""
Real,"Pasco County schools have graduation rates ""substantially higher than the state average"" and dropout rates ""below the state average."""
Real,"Says a drug test can be performed for ""just $4 or $5."""
Real,Cobb County businesses have already been awarded contracts worth $250 million on construction of a new Braves stadium.
Real,"Says Chris Christie ""vetoed Planned Parenthood funding five times over the course of his governorship."""
Real,"The National Science Foundation awarded $700,000 to fund a climate change musical."
Real,Says the top 20 percent of income earners pay nearly 70 percent of all federal taxes.
Real,"During a town hall meeting on health care, ""ABC didn't even allow ads that opposed the president's health care plan to be aired."""
Real,"In 2010, the non-partisan Government Accountability Office found that only 6.5 percent of the U.S.-Mexico border was under full control of the Border Patrol."
Real,"Once people become citizens under the DREAM Act ""and turn 21, they can sponsor their illegal immigrant parents for legalization."""
Real,Illegal immigrants currently occupy 8 million jobs.
Real,"Thirty-eight states -- Georgia not included -- have appointed, rather than elected, state school superintendents."
Real,More than three women per day lose their lives at the hands of their partners.
Real,About 85 percent of hotel guests who will pay the new $5 hotel/motel fee will be from outside Georgia.
Real,"Taxpayers earning $1 million pay an effective tax rate that is about four times what taxpayers earning $100,000 pay."
Real,Ted Cruz has been to Iowa four times. Rio Grande Valley of Texas -- just once.
Real,"At Twin River, ""we're more than competitive"" with nearby casinos in slot machine payouts."
Real,Measles is one of the most common causes of child blindness worldwide.
Real,"Oregonians have an ""amazing no-cost way to fight abortion"" with free political donations"
Real,"Assault weapons and handguns are allowed in the state Capitol while bullhorns, trumpets, helium balloons and flags on poles are banned."
Real,"Says ""by 4th grade, 86 percent of African-American boys and 82 percent (of) Hispanic boys are reading below proficiency levels."""
Real,Eighty percent of the antibiotics in this country are fed to livestock.
Real,Oil companies can obtain an acre of public land for less than the price of a Big Mac.
Real,The U.S. representatives that voted to keep militarizing the police received 73 percent more campaign money from the defense industry than the representatives who voted to stop it.
Real,"In 1968, a full-time worker earning minimum wage, could actually support a family of three above the poverty line. Today, that same worker would earn less than the poverty line for a family of two."
Real,"From 1947 to 1979, family incomes for rich, middle-income and poor Americans grew about the same rate. But since 1979, incomes for rich families have grown much faster."
Real,"Says Scott Walker's views on abortion are more restrictive ""than any Republican president in recent times."""
Real,"Over 3 million Americans are employed in the growing green-collar workforce, which is more than the number ""of people working in the fossil fuel industry."""
Real,"Federal law adopted ""under Tommy Thompson's watch"" prohibits the government from negotiating for ""better prices"" on prescription drugs for senior citizens"
Real,There are more members of the U.S. Senate than the number of WI families who would benefit from GOP estate tax break.
Real,"Says ""Tommy Thompson's tax plan amounts to an average tax cut of almost $87,000 for the top 1 percent."""
