Type,News
Real,Five percent of Americans pay over half the income taxes in this country. Forty percent of Americans pay no income taxes at all.
Real,I'm proud to have had a 100 percent pro-life voting record.
Real,So what sort of services does Romney's health care plan provide? Per the state Web site: $50 co-pay for abortions.
Real,"With those first principles, it allowed a fellow like me to get in his truck and go from one end of the state to the other; started 20 points down and wound up 20 points ahead on election night."
Real,I've cast a couple of 99-1 votes and been the lone dissenter.
Real,"Huckabee ""was one of the highest taxing governors that we had in this country and rivaling Bill Clinton in terms of the Cato ratings."""
Real,I supported tort reform with regard to securities...product liability...interstate commerce.
Real,I've seen (life) from the factory floor when I was working the graveyard shift ...and I'd be ankle-deep in water at the Murray Ohio bicycle plant where I was running a machine that was so loud I couldn't hear myself yell if I wanted to.
Real,"For the first time since the Korean War, total federal spending has gone down for two years in a row."
Real,Incoming House Speaker Dean Cannon and incoming Senate President Mike Haridopolos have said they plan to champion efforts next legislative session to allow oil rigs off Florida's coast.
Real,"Cigarette butts ""poison babies and small children because of the nicotine in them."""
Real,94 percent of winning candidates in 2010 had more money than their opponents.
Real,"Newt Gingrich ""teamed with Nancy Pelosi and Al Gore on global warming."""
Real,"Newt Gingrich ""was fined $300,000 for ethics violations."""
Real,Sunday liquor sales could generate $3.4 million to $4.8 million a year in additional sales tax revenue for Georgia.
Real,"Only five states, including Georgia, do not have a hate crimes law."
Real,"Says that in the U.S. House of Representatives ""weve had bipartisan support for the repeal of Obamacare  for getting rid of cap and trade  for building the Keystone Pipeline."""
Real,"The Milwaukee business community ""did not speak about the facts"" -- and in support of train manufacturer Talgo -- as the Milwaukee-Madison rail link was being killed."
Real,Americans are 20 times as likely to die from gun violence as citizens of other civilized countries.
Real,"Says the Portland Childrens Levy holds its ""administrative expenses to less than 5 percent."""
Real,7 out of 10 Oregon families living in poverty have at least one parent who works.
Real,"DeKalb County has cut more money from its general fund budget ""than any local government in the Atlanta metro region."""
Real,Women of childbearing age spend 68 percent more in out-of-pocket health care costs than men.
Real,Texas is LAST (50th) in spending for mental health care.
Real,"When we passed (the stand your ground law), we said it portends horrific events when people's lives were put into these situations."
Real,"SaysJeb Bush ""significantly cut early voting prior to the 2008 presidential election."""
Real,"Certainly we're going to be the most restrictive state in the land  in terms of who can get medical marijuana, how it will be prescribed and how it will be achieved in terms of moving it into the marketplace."
Real,Says recent polls show Americans agree with Republicans that the federal debt ceiling should not be raised and the debt and deficit should be dealt with mostly by cutting spending.
Real,"If you are African-American in this country today, you are likely to have a net worth of about 10 percent of what white families have."
Real,What happens is people like Warren Buffett  and he says this himself...pay 15 percent on the millions of dollars that they earn from wealth income... while their secretary is paying a higher rate on her work income. It's not right.
Real,"Poor people go to a ""payday lender...and they pay 300, 400, 500 percent interest."""
Real,We now have the greatest income inequality since the Great Depression.
Real,One out of every four homeless people on our streets is a veteran.
Real,Our children's safety is potentially at risk because nearly half of the apple juice consumed by our children comes from apples grown in China.
Real,"Clinton has ""raised the most money from Washington lobbyists ... from the health industry, drug companies, health insurance companies (and) the defense industry."""
Real,An estimated 56 million Americans don't have bank accounts.
Real,"If you go strictly by the numbers, crime is down across the board. Last year we had a 10 percent decrease in the most serious crimes."
Real,Claims Ohio Gov. John Kasich says climate change is a problem.
Real,"As CEO of WWE, Linda McMahon ""was caught tipping off a ringside physician"" about a federal investigation into illegally distributing steroids to wrestlers."
Real,"More women were killed by their husbands or boyfriends since Sept. 11 than ""all the Americans who were killed by 9/11 or in Afghanistan and Iraq."""
Real,"We have over 300,000,000 weapons, firearms in this country. Thats almost as big as the population."
Real,Many types of fish and shellfish from waters across the state are labeled unsafe to eat.
Real,"November 2012 was ""a record year of turnout. More people voted before Election Day using absentee ballots and voting early than ever before in our history."""
Real,"Research performed by economists has shown no consistent, positive impact on jobs, income or tax revenues arising from stadiums or sports franchises."
Real,"The R.I. Turnpike and Bridge Authority ""was supposed to exist only until the bonds used to build the Newport Bridge were paid off through tolls. Once the bonds were paid, the Newport Bridge was to be transferred to the State of Rhode Island and become toll-free."""
Real,"The unemployment rate is declining faster in Tampa ""than almost anywhere else."""
Real,Says no city comparable in size to Austin or smaller was broken into as many congressional districts.
Real,"Says Barack Obama ""promised he would cut the deficit in half"" but didnt."
Real,"In every state, women are paid less than men."
Real,"Every poll you see, the overwhelming majority of people want [E-Verify]."
Real,"Says ""cities save an estimated $38 in dental costs for every $1 invested in fluoridation."""
Real,"President Barack Obama ""had the legal authority"" to strike Syria without a vote from Congress."
Real,"The president can ""authorize the killing of a U.S. citizen who fights for a foreign terrorist organization."""
Real,"If you look at last year's presidential campaign, ""you can't find a mention of public option."""
Real,When is a farm bill not a farm bill? When 90 percent of it is for food stamps.
Real,The No. 1 cause of death for African-American males15-34 is murder.
Real,"The people who want President Barack Obama impeached ""are all white, they're all older, and guess what, they're in the far right wing of the Republican Party."""
Real,Less than half of the poorest American households have a home Internet subscription.
Real,"Says Dan Patrick ""proposed Arizona-style show-me-your-papers legislation."""
Real,"Says Mitt Romney told university students in Ohio that to start a business, they should ""borrow money if you have to from your parents."""
Real,Says Milken Institute rated San Antonio as nations top-performing local economy.
Real,Says Milken Institute rated San Antonio as nations top-performing local economy.
Real,"Up ""to 45 percent"" of illegal immigrants ""are not people that physically crossed the southern border or northern border. They are visa overstayers."""
Real,"Were seeing now 30 straight months of private-sector job growth, 4.6 million jobs created."
Real,Seven presidents before (Barack Obama) -- Republicans and Democrats -- tried to expand health care to all Americans.
Real,All travelers -- even babies -- arriving in the U.S. by air must have a passport.
Real,The health insurance plan that (members of Congress) have is no different than any other federal employee's in the United States government.
Real,"If you have a job in this country, (there's a) 97 percent chance that you're not going to be in poverty."
Real,Ohio currently ranks 50th out of all states in income growth.
Real,"The Seattle Times called Patty Murray ""a 'prolific sponsor of earmarks.' Patty even defended the 'Bridge to Nowhere.' """
Real,The UK has an unarmed police force and a firearm fatality rate that is 40 times lower per capita than in the U.S.
Real,"Says Jeb Bush ""said low-income women should get their life together and find a husband.'"""
Real,African Americans are twice as likely to be arrested and almost four times as likely to experience the use of force during encounters with the police.
Real,"The top one-tenth of 1 percent of Americans ""own almost as much wealth as the bottom 90 percent."""
Real,"For African-Americans between the ages of 17 and 20, ""the real unemployment rate  is 51 percent."""
Real,The gap between the very rich and everyone else in America is wider today than at any time since the 1920s.
Real,"A black male baby born today, if we do not change the system, stands a one-in-three chance (of) ending up in jail."
Real,99 percent of all new income today (is) going to the top 1 percent.
Real,"Half of all Americans have less than $10,000 in their savings account."
Real,"In 1990, the U.S. led the world in the percentage of 25-34 year olds with college degrees. Today we are in 12th place."
Real,"In 1952, the corporate income tax accounted for 33 percent of all federal tax revenue. Today, despite record-breaking profits, corporate taxes bring in less than 9 percent."
Real,The (New England) Patriots were led by an explosive offense that scored the second most points in the NFL.
Real,"47 percent of Americans""cant pay for an unexpected $400 expense through savings or credit cards, without selling something or borrowing money."""
Real,"The radiation coming from the new TSA body scanners is ""equivalent to about three minutes' worth of air travel by anybody, say, at 30,000 feet."""
Real,Says he would be first CPA to serve as Texas comptroller.
Real,The murder rate in Atlanta is on the rise this year.
Real,"Says female genital mutilation is ""a central African problem,"" not an Islamic problem, as Bill Maher suggested."
Real,"The Senate health care bill ""would leave 24 million people without insurance coverage."""
Real,Says most of Perry's chiefs of staff have been lobbyists.
Real,"By the end of Governor Rick Perry's term, he will have drained Texas taxpayers ... of more than $360,000 to pay for the rental mansion he has been living in while the historic Governor's Mansion is repaired."
Real,There's almost 1 million Texans who are unemployed and that's an all-time record number in our state.
Real,Debt has almost doubled in Austin under Gov. Perry.
Real,Our (Texas) graduation rate ranks 43rd out of 50 states.
Real,"During his tenure as mayor, he ""saw Houstons crime rates drop to the lowest levels in more than 25 years."""
Real,Rick Perry has become a millionaire on the public payroll.
Real,"Says Rick Perry told students he couldn't attend a gubernatorial forum due to scheduling conflicts, then on forum day ""tweeted that he'd just been running with his dog."""
Real,"Texas has ""a higher unemployment rate than neighboring states."""
Real,The state budget has gone up over 80 percent under Rick Perry.
Real,Rick Perry accepted more stimulus funds than any other governor except the governors of California and New York.
Real,"Gov. Rick Perry broke  his promise that he  would not accept a $40,000 pay increase."
Real,"Rick Perry attempted to fast-track unnecessary coal-fired power plants, which degrade air quality and would cost billions. Fortunately, a court stopped him."
Real,"Texas is experiencing the fastest population growth in the country, adding ""more than 1,000 people a day."""
Real,The U.S. has now spent more on reconstructing Afghanistan than was spent on the Marshall Plan and the reconstruction of Europe.
Real,"If it is enacted, the Senate immigration bill is ""going to make the Border Patrol bigger than the FBI -- you could put one agent every 250 feet."""
Real,More astronauts have been to the moon than farmers who paid the inheritance tax in 2013.
Real,"We're fifth in the world (in executions), behind China, Iran, Iraq and Saudi Arabia."
Real,"The average fast food worker is 29, and most fast food workers ""are on some form of public assistance."""
Real,"In Atlanta, since 1994 when the Seven Deadly Sins (mandatory minimum sentences) took effect, the violent crime rate has dropped 62 percent."
Real,You may have driven the length of a football field in the five seconds it takes to check a text.
Real,"Some businesses in Oregon ""are having to shrink back their businesses as a result of the law."""
Real,A majority of drunk driving deaths and injuries are caused by drunk driving offenders with no prior convictions.
Real,"Since 1999, all Virginia Lottery profits have been used for public education in the Commonwealth for kindergarten through 12th grade."
Real,The Republican presidential nominee hasnt won women since 1988.
Real,"If sea levels rise six feet due to climate change, Waterplace Park in Providence and Wickford village would be swamped"
Real,"Last year -- actually, this year in May -- we saw New Jersey Transit fares rise anywhere from 25 percent to 47 percent."
Real,Tells President Barack Obama that he also asked former President George W. Bush about how he felt about Americans hating him.
Real,A Democratic poll operation shows that Fox News is the most trusted news operation in the country.
Real,"Russia and China ""absolutely said clearly"" they would not keep economic sanctions on Iran if the United States ""walked away from the deal."""
Real,"When I go on Letterman the ""ratings go up."""
Real,"More than 50 percent of immigrants from (El Salvador, Guatemala and Honduras) use at least one major welfare program once they get here."
Real,"Says Nelson Mandela ""was a communist."""
Real,The right-to-work states have much lower level of unemployment than the union states do.
Real,More women are graduating from college now than men.
Real,The Senate health care bill does not contain limits on medical malpractice lawsuits.
Real,"To give the proposed economic stimulus plan some perspective, ""if you started the day Jesus Christ was born and spent $1 million every day since then, you still wouldnt have spent $1 trillion."""
Real,"Says Secretary of State John Kerry, ""when he was a senator, flew to Managua and met with a communist dictator there, Daniel Ortega, and accused the Reagan administration of engaging in terrorism."""
Real,"Raising the minimum wage to $10.10 an hour ""will destroy between half a million and one million jobs."""
Real,The minimum wage is mostly an entry-level wage for young people.
Real,"Says Health and Human Services Secretary Kathleen Sebelius told insurance companies ""they couldn't inform their policyholders of what they thought the impact of Obamacare would be on them."""
Real,"$100,000 in  stimulus funds (were) used for a Martini Bar and Brazilian Steakhouse."
Real,"If Obama's economic plan creates 600,000 new government jobs, ""that's about the size of the post office work force."""
Real,"Ken Buck wants to ""outlaw abortion, even in cases of rape or incest."""
Real,"Says that ""Tennessee law requires that schools receive half of proceeds -- $31 million per year"" -- from a half-cent increase in the Shelby County sales tax."
Real,"Says state's expected ""increase in federal political clout  is almost entirely due to  the growth of the African American and  Hispanic populations in Texas in  virtually every region of the state."
Real,Says Obama broke his promise to offer a comprehensive immigration bill in his first year.
Real,Says Obama promised to cut the deficit in half.
Real,Forty-seven percent of Americans pay no income tax.
Real,"At Bain Capital, ""we helped start an early childhood learning company called Bright Horizons that First Lady Michelle Obama rightly praised."""
Real,"In his first TV interview as president, Obama said we ""should talk to Iran."""
Real,"Half the kids coming out of college this year  can't find a job, or a job that's consistent with a college degree."
Real,"In 2008, candidate Barack Obama attacked John McCain for proposing cuts to Medicare."
Real,"As president, Barack Obama has never visited Israel."
Real,"Says ""Rick Santorum supported (Arlen) Specter over conservative candidates twice."""
Real,"If you take into account all the people who are struggling for work, or have just stopped looking, the real unemployment rate is over 15 percent."
Real,"Says Newt Gingrichs contract was with ""the lobbyists at Freddie Mac."""
Real,Says he followed state law and the precedent of other Massachusetts governors when he erased electronic communications as he left office.
Real,The people in Massachusetts like (the state health care plan) by about a 3-1 margin.
Real,"In writing his book, Gov. Perry pointed out that  by any measure Social Security has been a failure."
Real,"In the month of January, Canada created more new jobs than we did."
Real,"The lifespan of the average American is less than that of people in nations that spend far less (on health care). ... To put it bluntly, we spend more and die sooner."
Real,"John McCain has said the economy is ""not his strong suit."""
Real,Two-thirds of our economy is a consumer economy.
Real,"Now, I also support the Bush tax cuts. Sen. McCain voted against them originally. He now believes they should be made permanent. I'm glad he agrees they should be made permanent."
Real,(My dad) used to campaign against the gas-guzzling dinosaurs.
Real,Sen. McCain says it was not a mistake to vote against the Bush tax cuts ... but now says the tax cuts need to be made permanent.
Real,"Former business partner Robert Gay says: ""The man who helped save my daughter was Mitt Romney."""
Real,"Huckabee ""granted 1,033 pardons and commutations . . . more clemencies than the previous three governors combined."""
Real,"Romney said ""'No' to in-state tuition"" for illegal immigrants."
Real,"In the African-American community today, 68 percent of kids born are born out of wedlock."
Real,The mayor said  'if you happen to be in this country in an undocumented status . . . then we welcome you here.  We want you here.  We'll protect you here.' 
Real,"The truth of the matter is that during my administration, the FBI's crime statistics show that violent crime was reduced in Massachusetts by 7 percent."
Real,"We had a No Child Left Behind  a similar piece of legislation in our state a number of years ago, well before the federal law. And it's had a big impact here. It's improved schools."
Real,I don't think that Rudy or Fred or John McCain support the marriage amendment.
Real,Senator McCain voted against the Bush tax cuts. Now he's for them.
Real,Health insurance is more expensive in Massachusetts than anywhere else in the country.
Real,Rhode Island has taken its federal Medicaid funding and shown it can run the program more cost-effectively than the federal government.
Real,"6,400 Ohioans ... lost manufacturing jobs in the month of September."
Real,Pakistan has 100 nuclear warheads and theyre rushing to build a lot more. Theyll have more than Great Britain sometime in the relatively near future.
Real,"I went to the Olympics that was out of balance, and we got it on balance."
Real,The president said he was going to create daylight between ourselves and Israel.
Real,"Says a university survey concluded his Massachusetts administration ""had more women in senior leadership positions than any other state in America."""
Real,"Says Barack Obama has pension investments that include Chinese firms, and ""investments through a Caymans trust."""
Real,"Massachusetts schools ""are ranked No. 1 of all 50 states."""
Real,Were now spending 42 percent of our economy on government.
Real,"Says Barack Obama's comments indicate he ""believes in redistribution"" of wealth."
Real,Fifty percent of kids coming out of school can't get a job.
Real,"The Supreme Court said the individual mandate ""is a tax. So it's a tax."""
Real,"There are ""49 different federal job training programs that report to eight agencies."""
Real,President Obama's suggested reduction in spending for next year: $0.
Real,"Says Newt Gingrich said ""Spanish is the language of the ghetto."""
Real,"Our income, our GDP per capita, is almost 50 percent higher than (it is for) the average European."
Real,"Says he ""helped save"" the Olympic games."
Real,"Newt Gingrichs immigration plan offers ""a new doorway to amnesty."""
Real,"Massachusetts has ""less than 1 percent of our kids that are uninsured. You (Gov. Perry) have a million kids uninsured in Texas."""
Real,"Says that illegal immigrants get a $100,000 break on University of Texas tuition over four years."
Real,"Says that in his book, Rick Perry said that ""Social Security is unconstitutional."""
Real,"Says that 500,000 federal workers -- one-fourth of the federal workforce -- make more than $100,000 a year."
Real,"Says he worked with the Democratic legislature to balance spending with revenues so that ""at the end of my four-year term, the rainy day fund was established at more than $2 billion."""
Real,"Says that under President John F. Kennedy, ""government took up"" 27 percent of the economy, and today it ""consumes 37 percent."""
Real,"By the end of his first term, President Obama will have added as much debt as all the prior 43 presidents combined."
Real,"Hospitals, doctors, MRIs, surgeries and so forth are more extensively used and far more expensive in this country than they are in many other countries.''	Pay this bill and call me in the morning 	/truth-o-meter/statements/2010/mar/22/mitt-romney/romney-overstates-united-states-medical-costs-and-/	
Mitt Romney	1	McCain opposes repeal of the death tax."""
Real,"Mike Huckabee ""supported taxpayer-funded scholarships for illegal aliens."""
Real,Mayor Giuliani's lawsuit killed the line-item veto.
Real,"Mitt Romney boasts that he is ""proud to be the only major candidate for president to sign the tax pledge. The others have not."""
Real,Took on the Olympics and turned them around
Real,(McCain) was opposed to ethanol. Now he's for it.
Real,"Says Texas has one state inspector for every 4,500 oil and gas wells."
Real,"Historically, Senate ratification of arms control treaties ""has been bipartisan."""
Real,"Every month, another 50,000 U.S.-born Hispanics turn 18 and become eligible to vote."
Real,"With the exception of slavery and the Chinese Exclusion Act, our laws have never barred persons from becoming citizens."
Real,Says he was the only statewide elected official to speak in favor of a federal guest worker plan at the 2012 Republican Party of Texas convention.
Real,Says Barack Obama didn't keep his promise to have an immigration bill in his first year.
Real,"Says Texas General Land Office has earned the school  children of Texas $451,932.89 on wind leases that haven't produced a  watt of energy."""
Real,Firearms homicides are down about 40 percent since Texas passed concealed-gun permit law.
Real,Says a portfolio managed by the Texas General Land Office earned 22 percent last year while the states emergency reserve account experienced a 1 percent gain.
Real,"Were making more than  ever off oil and gas right now, but its no secret that oil production  in Texas peaked in the 1970s."
Real,"There are ""850,000 Ohio jobs tied to the auto industry."""
Real,Rob Portman won the fewest votes of all Ohio U. S. Senate victors since 2000.
Real,FACT: the special assistant in @johnkasich's office makes over three times more than an average #OH firefighter
Real,"A family of four can make up to $88,000 a year and still get a subsidy for health insurance under the new federal health care law."
Real,"Says Charlie Crist rode on a jet that ""belongs to a serial polluter with a history of environmental violations fined nearly $2 million for polluting water."""
Real,"In 2006, Charlie Crist opposed in-state tuition for illegal immigrants."
Real,"Says Charlie Crist ""raised taxes on the middle class"" by $2.2 billion."
Real,"Gov. Rick Scott cut the cost of prepaid college tuition by nearly $20,000."
Real,"Charlie Crist ""raised taxes in 2009 and won't rule out raising taxes again."""
Real,"Rick Scott ""invested $38 million in the Port of Jacksonville's vital Mile Point Project,"" which ""covered missing federal funds for the project."""
Real,"U.S. Rep. Alan Grayson ""compared a former vice president to a vampire ... and compared America's health care system to the Holocaust."""
Real,"Georgia has the 9th highest rate of adults, ages 18 to 64, without a high school diploma or GED."
Real,Federal investigators found a company that (David Perdue) ran discriminated against women -- paid them less than men for the same work.
Real,"A lot of what (Cubas) survival depends on is Venezuelan oil money, which is drying up."
Real,Wisconsin still ranks first among the 50 states in manufacturing jobs per capita.
Real,"As Dane County executive, Kathleen Falk raised property taxes by ""millions of dollars every year"" and approved the second highest increase in the state in 2010."
Real,About two-thirds of all consumption is services. . . It was just the opposite when the sales tax was enacted in the '30s.
Real,Caution: Kissing and cuddling chickens can be hazardous to your health.
Real,Wisconsins attorney general and state treasurer ordered the daughter of Earth Day founder Gaylord Nelson not to discuss climate change on state time.
Real,"Says ""if current trends continue, by 2040, one out of three Texas workers will not have a high school diploma."""
Real,Says businesses pay roughly 60 percent of taxes in Texas.
