Type,News
Real,"New Jersey loses net, that is minus those who come into the state, 30,000 students a year."
Real,"On financial reform, there is ""a million dollars being spent, per congressman, in lobbying expenses on this issue. (The) industry has four lobbyists per member of the House and Senate working on this."""
Real,"When we moved into the White House, we had the lowest net worth of any family since Harry Truman."
Real,"According to a recent poll, ""there are more young Republicans enrolled in their parents' (health insurance) plans than young Democrats."""
Real,"The Obama administration is allowing state waivers from welfare work requirements ""only if they had a credible plan to increase employment by 20 percent."""
Real,"Says U.S. Rep. Paul Ryan attacked the president for ""the same amount of Medicare savings that (Ryan) had in his own budget."""
Real,"Since 1961  our private economy has produced 66 million private-sector jobs. So what's the jobs score? Republicans 24 million, Democrats 42 (million)."
Real,I never had a filibuster-proof Senate.
Real,"Obama spent ""40 percent of the PAC money, 43 percent to be exact, on Iowa, New Hampshire, Nevada and South Carolina politicians."""
Real,"(Obama) did accept donations from lobbyists and PACs and he spent money in this campaign from that, through his political action committee."
Real,"The 1990s were a time of prosperity. We created more than 22-million new jobs, moved 8-million people out of poverty, and turned our economy around."
Real,"There's not a single, solitary example that signing the bill to end Glass-Steagall ""had anything to do with the financial crash."""
Real,"Says Hillary Clinton ""was completely exonerated, when I was in the White House"" by an officialinquiryon Whitewater."
Real,"Between 2010 and 2014, there was no net in-migration from Mexico."
Real,"Says President Barack Obama ""gives students the right to repay (federal) loans as a clear, fixed, low percentage of their income for up to 20 years."""
Real,"In the last 29 months, our economy has produced about 4.5 million private-sector jobs."
Real,"It took us four years to balance the budget. Then I gave you four surplus budgets for the first time in more than 70 years, paid $600 billion down on the national debt."
Real,"The Democrat-controlled Senate, it hasn't passed a budget in more than 1,000 days."
Real,New business startups are at the lowest levels in 30 years.
Real,"We have 10,000 baby boomers retiring every day."
Real,"Our spending has caught up with us, and our debt soon will eclipse the entire size of our national economy."
Real,"Says the House Rules Committee is the only panel, other than the Intelligence and Ethics committees, not able to telecast proceedings in its main hearing room."
Real,Says that the new financial services law requires 358 regulatory filings.
Real,"Members of Congress did not have three days to read the bill ""when the stimulus was rushed into law."""
Real,"Under the new health care law, ""if a landscaper wants to buy a new lawnmower, or a restaurant needs a new ice-maker, they have to report that to the feds."""
Real,The House has never failed to pass a budget in the modern era.
Real,Our national debt ... is on track to exceed the size of our entire economy ... in just two more years.
Real,"In the stimulus, ""$15 million dollars  went to 'build a bigger, better airport' for the town of Ouzinkie, Alaska,  population 165."""
Real,President Obama's proposed 'spending freeze' will only reduce the $42 trillion in government spending proposed between 2011 and 2020 by little more than one-half of 1 percent.
Real,"PWNED: House GOP Dominates Twitter, YouTube, Social Media in Congress."
Real,"As a candidate, President Obama ""declared that everyone deserves access to reproductive health care that includes abortion, and vowed that this 'right' would be at the heart of his health care reform plan if elected president."""
Real,"About halfway through fiscal year 2009, Washington has run out of money."
Real,I don't do earmarks. I've never done one. I'm not going to do one.
Real,The president campaigned against this type of legislation.
Real,"On immigration, ""the president said 22 times, 22 times, that he couldn't do what he eventually did."""
Real,"Despite touting the economic stimulus as a great triumph, ""The very same report, however, notes that unemployment will average 10 percent for the rest of the year."""
Real,A majority of Americans still oppose this health care bill.
Real,The House of Representatives has never passed a resolution of disapproval to condemn a member's behavior.
Real,Ohios Planned Parenthood operations received millions of taxpayer dollars via federal grants in 2010 and 2011.
Real,"Says Stefani Carter ""repeatedly used her campaign contributors donations to rent margarita machines for our state house office."""
Real,There are a lot of casinos across the country that have gone bankrupt.
Real,We're borrowing 40 cents of every dollar we spend.
Real,"Federal spending is ""the highest it's been as a share of our economy in 60 years (and) revenue is the lowest it's been as a share of our economy in 60 years."""
Real,"The American people say, don't touch Social Security, don't touch Medicare, don't cut defense. That's 84 percent of the federal budget."
Real,"After (Jeb) Bushs two terms in office, Floridas graduation rate was dead last and remains near the bottom."
Real,"For the last decade, Floridians salaries have shrunk substantially when adjusted for inflation."
Real,"Florida teachers are ""already paid $5,000 below the national average."""
Real,Weve dedicated more money from (Washington Countys) transportation budget to bike and ped projects under my watch than at any time in the history of Washington County.
Real,"About 106,000 soldiers had ""a prescription of three weeks or more"" for pain, depression or anxiety medication."
Real,"Texas has, now, the highest share of minimum-wage workers in the nation."
Real,Most Texans aren't millionaires.
Real,"We haven't had a Republican senator in Washington for ... why, I think Clifford Case was our last Republican senator."
Real,"The proudest accomplishment (of my tenure) was leaving the state with a $1.2 billion surplus, which was the largest wed ever had, and getting spending under control and a balanced budget."
Real,"Measures taken by my administration ""have saved taxpayers $1 billion."""
Real,"Says, ""In Oregon in 2010, 49 percent of all pregnancies were unintended."""
Real,To vote in Mexico every eligible Mexican citizen has to have a tamper-proof photo-ID card with a thumbprint and an embossed hologram.
Real,There is little if any evidence that the use of red light cameras in New Jersey has reduced the number or severity of accidents at the intersections where they are used.
Real,"The top 1 percent of income earners pay 40 percent of all state income taxes, and those at the bottom pay little or nothing."
Real,"Says enrolling a student in a subsidized lunch program triggers an ""at risk"" designation, resulting in an extra $6,000 to $7,000 of state school aid per student."
Real,"Says Rep. Steve Stockman ""basically wants gun-filled zones in schools."""
Real,The legislature was never given the opportunity to debate or vote on loaning $75 million to 38 Studios.
Real,"Gun ""marketplaces"" on Facebook mean ""ANYONE can broker a deal on a gun online, meet the seller in a parking lot somewhere, and walk away with a weapon."""
Real,"More people hunt and fish in Texas in a given year than attend the... games of the Dallas Cowboys, the Dallas Mavericks, the Houston Texans and the Houston Rockets combined."
Real,Says the U.S. Constitution provides for just compensation when land is taken under eminent domain.
Real,"David Dewhurst is ""the first lieutenant governor in history to have a personal security detail."""
Real,"Says the Obama administration approved a major disaster declaration for Oklahoma in 2009, when nine of the states 77 counties burned for ""about three days,"" while Texas wildfires have been burning for longer without such a declaration."
Real,"On average, Americans spend less than 10 percent of their disposable income on food. Compare that to folks in Mexico, who spend 22 percent, China, 28 percent and Russia, 37 percent."
Real,"The Department of Homeland Security is ""the only federal department not funded for this entire fiscal year"" by Congress."
Real,"Travis County is ""surrounded by red counties."""
Real,"Twenty-five states have lower unemployment than Texas which is ""tied with Mississippi for more minimum-wage jobs than anywhere in the United States."""
Real,I said no to these big bank bailouts.
Real,"With this reform, every insured American gets valuable consumer protections, and every uninsured American can become insured."
Real,As many as six federal department budget bills have been delayed because of opposition to amendments that would ban Confederate battle flag sales at federal building gift shops.
Real,"During the last election, Democrats won over a million votes more than Republicans, but because of the way districts are designed, the Republicans got 33 more members of the House of Representatives than the Democrats did."
Real,Says he represents or has represented about half the San Antonio-rooted district in which he seeks election.
Real,Says the main Central Texas food bank is delivering 50 percent more food to the poor than three years ago.
Real,"In Austin, Ive got half-a-dozen or more schools on a list to be closed  one of which I presented a federal blue-ribbon award to for excellence. And several hundred school personnel on the list for possible terminations."
Real,The richest 1 percent of America will get a bigger tax cut through this bill than the family income of the average family here in Central Texas.
Real,Donna Campbell has called for ending all federal funding for education
Real,"Common Core ""is not from the federal government,"" they ""do not have their fingerprints on this thing at all."""
Real,The only time over the last 25 years when the states unemployment rate exceeded the U.S. average was when (Mary) Burke was commerce secretary.
Real,"At protests in Wisconsin against proposed collective bargaining changes, ""phony sick notes (were) passed out to excuse striking union members."""
Real,"Because of (U.S. Sen.-elect Ron) Johnsons leadership, Senate Republicans adopted a caucus ban on earmarks."
Real,"Says ""Rep. Jim Weidner proposed a bill taking away health care for 80,000 of Oregon's children."""
Real,"We have a retiree that is collecting a $17,000 paycheck a month . . . tax free."
Real,Our median income here in Providence is the same as the median income in Mississippi.
Real,In the last six years of Ciancis administration violent crime was down in the United States. It was down in the region. It was down in Rhode Island. But it was up in Providence.
Real,"Other Western countries have ended their ""Don't Ask, Don't Tell"" policies."
Real,"Gov. Maggie Hassans budget proposal ""raises taxes on small businesses and increases taxes and fees by $100 million."""
Real,"A Cornell University research study concludes that ethanol generates a 29 percent energy loss, meaning it takes more than a gallon of gasoline to produce a gallon of ethanol."
Real,"Tallahassee is ""the ninth-rainiest (city) in the nation."""
Real,"We just don't want to get to be like Louisiana, where you have drive-up daiquiri shops."
Real,"The average bonus [on Wall Street] is about $100,000...The bonuses on Wall Street are down 44 percent."
Real,"The reality is, we are holding some of the most dangerous terrorists in the world right now in our federal prisons, including the mastermind of the 1993 World Trade Center bombing, the 'shoe bomber,' the 'Unabomber,' and many others."
Real,Uber and other ride-share firms are not required to carry auto insurance under Georgia law.
Real,One third of our age group (Millennials) have moved back in with their parents.
Real,Governor Carcieri has not been campaigning with me.
Real,"Republican candidate for governor Ken Block was ""fined and had to admit that (he) funneled money illegally to the Moderate Party."""
Real,"Cranston's 2014-2015 ""budget funds 100 percent of the local police and fire pension and other retiree benefit costs."""
Real,"We have created new jobs here in Cranston -- more than 1,000."
Real,President Barack Obamas judicial appointments for Georgia and the region were drafted in secret and not vetted by legal groups among the presidents supporters.
Real,The U.S. Supreme Court has not traditionally asked a lot of questions during oral arguments.
Real,"Contends that President Obama ""literally said (if) his cap-and-trade proposals were to pass, that utility rates, his words now, would, 'necessarily skyrocket.'"""
Real,Tens of billions of dollars (from taxpayer-funded bailouts) ... flowed straight through AIG into the coffers of foreign corporations and foreign banks.
Real,"The stimulus bill contains ""$20 million for the removal of small to medium-sized fish passage barriers"" and ""$25 million to rehabilitate off-roading trails for ATVs."""
Real,Exit polls indicate that Democrats get over 70 percent of LGBT votes in federal elections.
Real,"Says ""excise taxes are...disproportionately burdening middle- and lower-income consumers."""
Real,"Over the last 15 months, we've added more than 2 million jobs in the private sector. That's far in excess of what it was in the comparable period after the last recession."
Real,Manufacturing is having its best employment year in almost 15 years.
Real,"Extending current tax rates would ""average more than $100,000 a year to millionaires and even billionaires."""
Real,"If you're a Mexican, you get sent back. ... But if you're from a noncontiguous country like the Central American countries then you can stay in the United States."
Real,"Says Sen. Rand Pauls 2011 budget ""included a big cut in the CDC."""
Real,"Weve saved over $100 million of (health care) costs in Milwaukee County. ""I did that."""
Real,"A bill delaying the start of classes until Labor Day would permit school districts ""to shave 5 full weeks off the school year."""
Real,"Says President Barack Obama ""came into office very concerned about"" wiretappings but ""then he became president of the United States, he got all the briefings  (and) he decided  the balance is probably pretty appropriately struck."""
Real,Forty percent of union members voted Republican in 2008.
Real,"Twenty percent of our electricity currently comes from nuclear power plants. I think there are 104 in the United States, two of them around the coast in California."
Real,"The Senate immigration bill is  filled with things like rewards for au pair agencies, Alaskan seafood processors and Vegas casinos."
Real,"The truth is, Planned Parenthood does not provide mammograms. Planned Parenthood refers women to mammography providers, serving as the middlewoman, if you will."
Real,Says U.S. Senate candidate David Perdue flip-flopped on releasing his tax returns.
Real,Seventy-two percent of Georgians did not have a chance to finish college.
Real,"Obamacare will provide coverage for abortions, despite the presidents commitment that it would not."
Real,"A ""fairly limited number of people, 25 million to 30 million,"" will be allowed to access a national health insurance exchange."
Real,No family earns too much to qualify for Oregon Healthy Kids program.
Real,"Says Rep. Bruce Braley, D-Iowa, missed ""79 percent of veterans affairs committee hearings."""
Real,"The average person ""will pay $6,000 more a year"" under Rep. Paul Ryan's Medicare proposal."
Real,"From '05 to '09, we've had 1,100 soldiers commit suicide, one every 36 hours."
Real,"Congressman Ryan has secured a grand total of $116,838,763 to date (for the Mahoning Valley) and has an additional $27,095,000 pending in FY2010 spending bills."
Real,"If you are born poor in America, we rank ninth or tenth in our citizens ability to climb up through that ladder and get themselves into the middle class."
Real,"Attacks on Planned Parenthood ""come at a time when the poverty rate among women is the highest in nearly two decades and 1 in 5 women under 65 dont have access to health care."""
Real,We have a $2 trillion to $3 trillion infrastructure deficit. Weve got work that needs to get done. Weve got people that want to go to work.
Real,"Were only spending 2 percent of our GDP on our infrastructure, while China and India are spending 10 percent of their GDP reinvesting back into their country."
Real,"For every dollar we invest in Head Start, we get $5 to $7 back into our economy."
Real,"Georgia loses ""millions of dollars of revenue because people go out of state to buy fireworks."""
Real,"Georgia has the nation's fifth largest Women, Infants and Children (WIC) Supplemental Nutrition program, serving more than 270,000 mothers, babies and children every day."
Real,The majority of (the American people) voted for a Democratic House.
Real,Says up to a quarter of African Americans dont have government photo ID.
Real,There were more job losses per month in the last three months under President Bush than in the past three months under President Obama.
Real,Some 500 detainees were released from Guantanamo during the Bush administration.
Real,"Says ""MAX carries 30 percent of evening rush-hour commuters traveling from Downtown on the Sunset and Banfield freeways."""
Real,"The president's party always gets shellacked in midterms. It's only twice, 1934 and 2002, that the president's party actually gained in both the House and the Senate."
Real,"Likens Obama's predicament to 1982, saying, ""when Reagan just started out, (unemployment was at) exactly the same point. He was two years into his term. The unemployment was well over 10 percent, and it did come out of it."""
Real,Says opponent Ted Cruz has not led businesses.
Real,"Says ""we brought crime rate down by 30 percent"" when he was mayor of Dallas."
Real,"Says 31 percent of Texas physicians accept all new Medicaid patients, down from 67 percent in 2000."
Real,Sometimes I was the only 'no' vote on the entire board.
Real,"Bill Heller ""raises taxes. Property taxes. Small business taxes. He even wants to tax the Internet. Mr. Heller said no to balancing the federal budget, that puts more debt on our kids."""
Real,"Sen. Kay Bailey Hutchison's  ""concession speech came with less than 20 percent of the precincts  having been counted."
Real,This is the only state in the country that bypassed the General Assembly to authorize [in-state tuition for undocumented immigrants].
Real,Says Michelle Nunn has acknowledged allowing a convicted felon to hold a fundraiser for her.
Real,"U.S. Senate candidate Michelle Nunn ""earned as much as $300,000 running a nonprofit that had laid off 90 workers."""
Real,"On day one, six people were able to sign up for health insurance through the federal marketplace."
Real,"Says paid family leave is ""a program that is standard in all but five nations around the world."""
Real,"The United States ""has never been richer, if you look at per capita GDP."""
Real,Half of all adults have a pre-existing condition that could affecttheir health care coverage.
Real,"Seven of Americas 10 wealthiest counties are in the Washington, D.C., area."
Real,"The federal government has ""77 different means-tested social welfare programs."""
Real,"The national debt is ""larger than our entire annual economy."""
Real,Eighty percent of all U.S. communities depend solely on trucks to deliver and supply the products sold in stores or ordered online.
Real,President Obama's recent plan to cut $100 million of waste within his administration won't actually save money because he's going to spend it elsewhere.
Real,"Americans spend ""6.1 billion hours a year"" on tax preparation."
Real,"There are 3.6 million jobs sitting vacant, in part because there arent enough qualified applicants to fill them."
Real,The potential Iran nuclear agreement would limit Iran to the number of centrifuges needed for a weapon but too few for a nuclear power program.
Real,"In annual surveys of Rhode Island communities that receive Drug Free community grants, many report that more than 50 percent of youth surveyed do not think daily marijuana use poses any serious risk of harm."
Real,"Wisconsin is ""dead last in income growth"" among midwestern states during Gov. Scott Walkers term."
Real,U.S. Embassy Celebrates Americas Independence on June 4th in Order to Accommodate Muslims.
Real,"Forty aides who serve President Barack Obama ""owe $333,485 in back taxes."""
Real,Republican-leaning states get more in federal dollars than they pay in taxes.
Real,"The Baucus health care bill would require taxes on medical devices such as X-ray machines, female condoms, HIV tests and surgical needles."
Real,"The Obama administration is using as its ""legal justification for these airstrikes (on the Islamic State), an authorization for military force that the president himself has called for repeal of."""
Real,"A report by the health insurance industry ""ignores some of the key policies that are part of the Senate Finance Committee bill."""
Real,Says military expenditures for the United States are greater than the combined spending of the next 14 largest nations.
Real,"Laurie Monnes Anderson ""voted to let violent criminals out of jail early."""
Real,"As secretary of the Department of Energy under former President Bill Clinton, ""I created reserves of home heating oil."""
Real,"Three out of the 18 benchmarks of the (GAO) have been fulfilled. Even among Republican math, that is a failing grade."
Real,"Among Hispanics, support for immigration reform is close to universal."
Real,Today New Mexico (has) the sixth-fastest growing economy.
Real,Bill Richardson is the only major Democratic candidate with a plan to withdraw all American troops from Iraq. All of the other major Democratic candidates support leaving American troops in Iraq indefinitely.
Real,Congress only funded half the wall between Mexico and the United States.
Real,"Bill Richardson passed the first law in the nation giving National Guard soldiers $400,000 in life insurance."
Real,"I used tax cuts to help create over 80,000 jobs in New Mexico."
Real,"New Mexico moved ""up to"" sixth in the nation in job growth."
Real,"New Mexico was 46th in teacher pay (when he was elected), now we're 29th."
Real,Im the only candidate for Milwaukee County executive that has voted against increasing government pensions.
Real,I never proposed privatizing the (Milwaukee County) airport.
Real,"Says Chris Abele, opponent in Milwaukee County executive race, ""failed to finish 3 separate colleges, dropping out all 3 times."""
Real,We spend more money on lobbying than we do on campaigns.
Real,"Last week's three most-viewed television programs wereSunday Night Football, Thursday Night Football and Monday Night Football."
Real,Says 18 states and the District of Columbia have voted Democratic in six consecutive presidential elections.
Real,We lost more jobs in this great recession than the last four recessions combined.
Real,"Federal spending is ""all discretionary, other than interest on the national debt. Social Security is discretionary. We have the discretion to change the law. Same is true with Medicare and Medicaid."""
Real,"If Wisconsin's governor cuts perquisites as much as he plans to do, ""it would still leave (workers) better off than their private sector"" counterparts."
Real,"During the recession, ""the consumer in his native perversity has begun to save. The savings rate is now 6.2 percent."""
Real,"Greece ""has a GDP the size of the Dallas-Fort Worth Metroplex."""
Real,"Every year tobacco kills more Americans than did World War II  more than AIDS, cocaine, heroin, alcohol, vehicular accidents, homicide and suicide combined."
Real,"Congress shoveled $700 billion into the Troubled Assets Relief Program, $325 billion of which has been spent without purchasing any toxic assets."
Real,"Says Bernie Sanders chose ""to spend his honeymoon in the Soviet Union in 1988."""
Real,"Says Jeb Bush ""happens to be where a majority"" of Republican voters areon giving legal status to illegal immigrants."
Real,What the Arizona law does is make a state crime out of something that already is... a federal crime.
Real,"When we started this health care debate a year ago, 85 percent of the American people had health insurance, and 95 percent of the 85 percent were happy with it."
Real,Have the suburbs been inundated with former residents of Atlanta housing projects? Absolutely not.
Real,Atlanta has issued an increasing number of citations - and collected an increasing amount of revenue - since Mayor Kasim Reed took office in 2010.
Real,"Pinellas County voters ""elected me as their chief financial officer  (and) elected me as (their) governor four years ago."""
Real,"150,000 (oil spill) claims have been filed by Floridians, but only 40 percent of them have been paid."
Real,Florida ranks last in the ratio of employees to residents...And Florida is dead last in the nation in state employee payroll expenditures per resident.
Real,"House Republicans who complained they didn't have enough time to consider a constitutional ban against oil drilling ""shoved through a proposal in just a few days to open state waters to oil drilling."""
Real,Floridas high school graduation rate falls well below the national average.
Real,"Rick Scott ""was forced to resign as the head of a company that pled guilty to massive amounts of systematic fraud, including 14 felonies, leading to a historic $1.7 billion fine."""
Real,Rick Scott's even saying he wants more offshore drilling.
Real,The Senate Republican education plan is an unfunded mandate for local school districts.
Real,"As Florida's CFO, I shut down Krakow's scam and refunded more than $1.2 million to Josephine and other victims of this con man."
