Type,News
Real,"The Banking Committee voted a 1,336-page bill ""out of committee in 21 minutes with no amendments, with the understanding that before the bill came to the floor, we would reach this bipartisan agreement."""
Real,"U.S. unemployment among people ages 16 to 24 is ""18.4 percent, which is a 60-year high."""
Real,We've seen six months of positive job growth by the private sector.
Real,"Says the city of Portland has one manager for every six ""front-line"" workers."
Real,"Says if elected, he would be the first Mayor who lives east of 82nd."
Real,"Says Minnesota has more Fortune 500 companies than Oregon and ""one of the most obvious differences is they've invested in their schools."""
Real,"Says ""I dont agree with Mr. Hales that we should give a sweeping break to the developers to allow them to build that infill housing without paying for those very basics."""
Real,"Says ""at the state level we're spending more on tax expenditures than we are on public safety, health care and education combined."""
Real,A test last month at the MAX station at 162nd Avenue and East Burnside saw crime down 41 percent compared with December 2009
Real,I was speaking out on pension reform almost 17 years ago.
Real,"A 50-50 public-private split for paying for a new Milwaukee Bucks arena would ""be much better -- in terms of the portion of the public financing -- than most of the other arena projects done around the country."""
Real,"Gov. Romney was very clear, he would veto the DREAM Act."
Real,"The loan guarantee program that helped Solyndra ""was a program that was supported by President Bush."""
Real,"Says Oregon is ""near the top or at the top of the list"" when it comes to capital gains tax"
Real,"David Beckhams soccer stadium would get a ""special tax deal that lets them off the hook for $2 million in taxes every year for 30 years."""
Real,"Re: (Marco) Rubio's support of earmark ban: In 2002 alone, he requested 37 earmarks worth $43 million."
Real,[Appalachian Power] wants another 10 percent rate increase. The compensation package for CEO Mike Morris rose 22 percent to $8.7 million in 2010.
Real,"A telephone company will no longer have to provide landline service to customers if there is an alternative provider, including wireless."
Real,"There are 321,092 public school teachers in Texas. And there are 313,850 non-teachers in our public schools."
Real,The addition of a 1 percent sales tax would cost a typical household in Hillsborough County approximately $12 a month.
Real,"Kendrick Meek claims he's the only candidate who saidSonia Sotomayor ""will make an excellent Supreme Court justice."""
Real,Warren Buffett called credit default swaps financial weapons of mass destruction. And Greene was the first individual to use them.
Real,Jeff Greene can buy anything ... he owns two mansions.
Real,"Democratic candidate Jeff Greene ""ran for Congress as a California Republican."""
Real,"Jeff Greene only moved from California to Florida in the last two years. In fact, he would not legally be allowed to run for any other statewide office because he has not lived here long enough to meet the residency requirement."
Real,"The first time he ever voted as a Democrat was here in Florida in 2008. He only voted four times in his life, and he's asking Floridians to come out and vote for him."
Real,"When I become the nominee, the Democratic  nominee, I will be the only pro-choice candidate on the ballot."
Real,Kendrick Meek is the only candidate who has consistently been against expanded drilling.
Real,"Florida ""has the second-highest foreclosure rate in the nation."""
Real,"There currently are 825,000 student stations sitting empty across Florida in every district and at every grade level."
Real,"The Tampa Bay Rays' ""prices have been judged the most affordable in all of professional sports."""
Real,"The United States has experienced ""40 straight months of unemployment at 8 percent or higher."""
Real,"A Penn State University study found that ""electronic cigarettes . . . are far less addictive than cigarettes."""
Real,New provisions of the health care law bar the use offlexible spending accounts and health savings accounts to pay for aspirin and other non-prescription health needs.
Real,Greece is not a big economy. It's about the size of metropolitan Miami.
Real,"Says ""there have been some job gains in the McMansion State since Mr. Christie took office, but they have lagged gains both in the nation as a whole and in New York and Connecticut, the obvious points of comparison."""
Real,"One in four Texans lacks health insurance, the highest proportion in the nation."
Real,There are actually half a million fewer government employees now than there were when (President Barack) Obama took office.
Real,The average unemployed American has been out of work for almost 40 weeks.
Real,"Large majorities of the public ""oppose major changes to Medicare"" and favor higher taxes on the wealthy."
Real,Says taxes paid by the poorest residents of Texas are above the national average.
Real,"Texas leads ""the nation in the percentage of residents without health insurance."""
Real,"Says that ""data from the Center on Budget and Policy Priorities suggest that the Texas budget gap is worse than New Yorks, about as bad as Californias, but not quite up to New Jersey levels."""
Real,"The Senate-passed health care bill ""is identical to the Massachusetts health care plan -- the same thing."""
Real,"If you want to talk firsts for Bush, this was the first time in American history that a president took us into a war and cut taxes."
Real,"Even high estimates for an early draft of the health care plan are ""less than the $1.8 trillion cost of the Bush tax cuts."""
Real,"If the government shuts down, ""all military personnel will continue to serve and accrue pay but will not actually be paid until appropriations are available."""
Real,"If you go back to 1999, Wayne LaPierre testified on behalf of the NRA that background checks were appropriate and should be done."
Real,"Over the past 10 years, the number of people living in Lower Manhattan has nearly doubled. In fact, Lower Manhattan has added more people over the last 10 years than Atlanta, Dallas and Philadelphia combined."
Real,There is already a mosque four blocks away.
Real,"We can prevent terror suspects from boarding an airplane, but the FBI doesn't have the power to block them from buying dynamite or an AK-47."
Real,"New York is the safest big city in the nation, and our crime reductions have been steeper than any other big citys."
Real,Georgia and other states with weak gun laws have more crime.
Real,His biography says he was the top ROTC officer in the nation.
Real,Rhode Island has a very generous unemployment compensation rate compared to most other states.
Real,"The federal government is spending $46,000 a year per family (or group of four) and could balance its budget by dropping that to $30,000."
Real,"Says the federal government could save $175,587 by eliminating a study of the ""connection between cocaine and risky sex habits of the Japanese quail."""
Real,My supporters aren't special interest groups in Madison and Milwaukee.
Real,The average age of members of the House of Representatives is 57 years old.
Real,Currently it costs more than a penny for the U.S. Mint to make a one cent coin and more than a nickel to make the five cent piece.
Real,They're paying a less rate of tax -- these richest people in America -- than they have in the last 80 years.
Real,The refusal of many federal employees to fly coach costs taxpayers $146 million annually.
Real,"Most women, including 98 percent of Catholic women, have used contraception."
Real,"John McCain ""said publicly that Hillary Clinton would make a good president."""
Real,"Sue Lowden gave Harry Reid's campaigns a thousand dollars in five different elections, helping his Senate dreams come true."
Real,Did you know that the U.S. is one of the very few nations in the world without an official language?
Real,Says the U.S. fleet of attack submarines is scheduled to fall below the 48 boats that Navy says it needs to carry out current missions.
Real,"The national debt is equal to $48,700 for every American or $128,300 for every U.S. household. It is now equivalent to the size of our entire economy."
Real,Failure to raise the debt limit does not force a U.S. default on debt payments.
Real,Each day our nation pays communist China $73.9 million in interest on our debt.
Real,The IRS doesn't have to prove something against you ... you've got the burden of proof.
Real,1.53 million jobs are at risk (from potential defense cuts).
Real,"As a percentage of our gross domestic product, the defense budget remains just 3.6 percent. This figure is low by all historical standards."
Real,"If you make the average amount of people in Wisconsin, $50,000, you got $1.60 less a week in taxes under the state income-tax cut, but ""it didnt show up in your paycheck."""
Real,"In 2010, Mr. [Anthony] Gemma described himself as a 'pro-life' candidate. Now, he claims to be pro-choice."
Real,Says Obama has flip-flopped on public campaign financing.
Real,Georgia has the fifth-highest number of uninsured people of any state in the union.
Real,They're saying that 40 percent of the traffic that goes over [the Sakonnet River Bridge is from] out of state.
Real,"Taxpayers pay $18,000 a month for House Speaker Nancy Pelosi's district office in downtown San Francisco."
Real,"Atlanta Mayor Kasim Reed became a city resident in the last annexation, opening the door to his candidacy."
Real,"Ninety percent of people living in Gaza ""dont have access even to water."""
Real,"If you printed a $1 bill for the entirety of the $14.1 trillion national debt, the resulting pile of money would weigh more than 136 aircraft carriers."
Real,From the Do As I Say Not As I Do department: federal employees owe $3.3 billion in back taxes.
Real,"Donna Shalala left me with 12 million doses of smallpox vaccine and ""I created enough"" to vaccinate ""every man, woman and child against smallpox in America."""
Real,"Tommy Thompson is the father of welfare reform, creating the groundbreaking Wisconsin Works program in Wisconsin that became the model for national and international reforms."
Real,"Tommy Thompson created the first school choice program in the nation, giving thousands of Milwaukee students the choice of where they go to school  no matter where they live or how much money their parents make."
Real,"Says U.S. Senate rival Tammy Baldwin wants a ""completely government-controlled"" health care system that goes ""far beyond 'Obamacare'"" and is ""a Medicare system for all."""
Real,"Says U.S. Senate rival Eric Hovde ""refused to pay his property taxes until he was taken to court."""
Real,"Says that as Wisconsin governor, ""we ended welfare."""
Real,"During my tenure as governor, Wisconsins overall tax burden went DOWN."
Real,"Says Democratic U.S. Senate candidate Tammy Baldwin ranks ""as the most liberal member of the House."""
Real,"Four percent of American citizens are black males, but they are 35 percent of murder victims."
Real,"The sex-offender registry has been around for a long time, and the research that's out there says that it has no positive impact on the public safety."
Real,"Says ""tenure still exists but it's been overhauled"" for teachers in New Jersey."
Real,"Says that as a gubernatorial candidate, Chris Christie ""promised no school cuts."""
Real,"People want the minimum wage, they want marriage equality, they want womens health care. Theres issues that actually that really do matter, social issues that matter to the people of this state. So I know Barbara would support those issues, I know the governor hasnt. Youve seen the actions hes taken on them."
Real,Medicaid is the primary source of health insurance for 41.7 percent of Hispanic children in Georgia.
Real,"In Texas, schools do not even have to teach sex education."
Real,"State ""school funding per pupil is down 16 percent compared to 2009, after adjusting for inflation."""
Real,Says Texas has the 15th largest economy in the world.
Real,Only 3 percent of voters 18 to 34 don't believe that climate change is really happening.
Real,"Says President Barack Obama has launched ""twice as many strikes (on)countries that are predominantly Muslim"" than President George W. Bush."
Real,The United States death rate is two-and-a-half times higher for those who do not have a high school education.
Real,"Rhode Islands voter identification law was pushed by ""a black Democrat in the House, a black Democrat in the Senate. That's a fact."""
Real,Palin (proposed) a $150 bounty for the severed foreleg of each killed wolf.
Real,"Palin supports ""aerial hunting of wolves and other wildlife."""
Real,"The president referred to the Syrian opposition just a few months ago as pharmacists and doctors, and so on."
Real,"Virginia ""spends less per student today than we did in 2008."""
Real,"Says Scott Brown ""voted to give oil companies big tax breaks."""
Real,It's been nearly three weeks since the president has commented on questions about possible hidden wait lists at veterans hospitals.
Real,"This governor has cut funding repeatedly for people who have AIDS, who need drugs to save their life."
Real,Mitt Romney received exactly zero votes in at least 12 Cuyahoga County precincts.
Real,"In July 1996, Mitt Romney helped locate the missing teenage daughter of a partner at Bain Capital."
Real,"Obama has ""visited more countries and met with more world leaders than any president in his first six months in office."""
Real,All private healthcare plans must conform to government rules to participate in a Healthcare Exchange.
Real,McCain tells of a fellow Vietnam POW who was beaten for fashioning an American flag that became an inspirational symbol to fellow POWs.
Real,She flunked the D.C. bar exam.
Real,"Palin ""fired Wasilla's Police Chief because he 'intimidated' her."""
Real,"Palin ""inherited a city with zero debt, but left it with indebtedness of over $22-million."""
Real,Says Obama replaced the American flag on the tail of his plane with his campaign logo.
Real,Barack Obama's church gave a lifetime achievement award to Louis Farrakhan.
Real,"The church Barack Obama belongs to has a ""nonnegotiable commitment to Africa."""
Real,The number of terrorists out there has doubled.
Real,"The Obama administration notified Poland and the Czech Republic about cancellation of major missile-defense facilities ""at the last minute in midnight phone calls."""
Real,You've heard endlessly about waterboarding. It happened to three terrorists.
Real,"Says Mike Enzi is ""getting about 84 percent of his campaign funds from Washington-based PACs. That's more than any senator of either party."""
Real,"President Obama's own director of national intelligence, Admiral Blair, put it this way: 'High-value information came from interrogations in which those methods were used and provided a deeper understanding of the al-Qaida organization that was attacking this country.'"
Real,"Says 97 percent of food stamp benefits ""are paid in the proper amounts to people who are really eligible."""
Real,"This Congress made history as the least productive, most unpopular Congress in the history of this proud nation."
Real,"The average student loan debt in Texas is over $22,000...the cost of an average size pickup truck. But unlike car owners, ""students are not allowed to refinance their loans at lower rates."""
Real,It is legal in Ohio to fire an employee or evict a tenant just for being gay.
Real,"In 2009, Yost spent 2.5 times more money than it took to run the (prosecutors) office before he got there."
Real,A bill before the Georgia General Assembly would make presidential candidates meet citizenship requirements that are not in the U.S. Constitution.
Real,Says Georgia Power customers pay 10 percent to 15 percent below the national average for electricity.
Real,"The changes to Georgias tax and fee structure ""is an overall tax cut."""
Real,Governor Deal has increased education spending every year hes been in office.
Real,Half the lottery directors across the country had not run a lottery before they were hired.
Real,"This March, for the first time in human history, the monthly average carbon dioxide in our atmosphere exceeded 400 parts per million. The range had been 170-300 parts per million for hundreds of thousands of years."
Real,"January through November 2014, the year so far, were the hottest first 11 months of any year recorded."
Real,"The United States ""decided waterboarding was torture back when we court-martialed American soldiers for waterboarding Philippine insurgents in the Philippine revolution."""
Real,There are already more American jobs in the solar industry than in coal mining.
Real,We have more people working in clean and green energy than in oil and gas in this country.
Real,"Rhode Island has the ""the second-most heavily deployed National Guard in the United States."""
Real,The American healthcare system burns 18 percent of our national GDP. Nobody else is close.
Real,"In 1976, the first year that Pell Grants were fully funded, a full Pell Grant paid 72 percent of the cost of attendance at a typical four-year public college. Today, a full Pell Grant covers just 34 percent of those costs.	Soaring college costs eroded Pell Grant buying power	/rhode-island/statements/2011/sep/22/sheldon-whitehouse/sen-whitehouse-says-full-pell-grants-cover-only-34/	
Sheldon Whitehouse	0	Some criminals have learned how to spy on Americans, hacking into our home computers and looking out through the video camera attached to the screen."""
Real,"The law, right now, permits companies that close down American factories and offices and move those jobs overseas to take a tax deduction for the costs associated with moving the jobs to China or India or wherever."
Real,"61 percent of non-tea party Republicans actually agree...there is 'solid evidence the earth is warming,' ...[but] 70 percent of tea partiers, contrarily, say there is 'no solid evidence' the earth is warming."
Real,"In a poll, ""53 percent of young Republican voters . . . under age 35 said that they would describe a climate [change] denier as 'ignorant,' 'out of touch' or 'crazy.'"""
Real,Thirteen hundred applicants in Rhode Island signed up for insurance through Obamacare.
Real,"The oceans ""have become 30 percent more acidic."""
Real,"For Social Security, which is projected to remain solvent through 2033, Whitehouse has cosponsored [a bill that] . . . would extend the life of the program by an additional 75 years."
Real,"An April study found that about 70 percent of ads in this election cycle have been negative [due to SuperPACs], up from only 9 percent through the same period in 2008."
Real,"The richest 400 taxpayers are taxed at a lower rate than a $29,000-a-year worker"
Real,"The last time Republican U.S. Senate candidates ""beat more than two (incumbents) was 1980."""
Real,"We have one of the most expensive General Assemblies, per capita, in the entire country."
Real,Almost every state has offered an insurance plan on its health exchange that does not cover abortion.
Real,"If we keep the minimum wage at the current level, then single-parent families earning the minimum wage at a full-time job will live in poverty in New Jersey."
Real,More children die in agricultural jobs than in any other industry.
Real,"Says 77 percent ""of Portland's students finish elementary school without taking even one art class."""
Real,No one was taken into custody for feeding the homeless.
Real,"Says New Jersey has gained ""143,000 new private-sector jobs."""
Real,"In fact, theres more state funding for education today than any other time."
Real,"In fact New Jersey is a donor state, we get 61 cents back on every dollar we send to Washington. And interestingly Kentucky gets $1.51 on every dollar they send to Washington."
Real,"Buono voted 154 times to raise our taxes -- like the sales tax, the income tax, health care taxes, even small business taxes."
Real,"In total, we have added nearly 75,000 private sector jobs in New Jersey since we took office in January 2010."
Real,Gross income tax receipts are exceeding the Administrations projections for this fiscal year prior to Sandy.
Real,"A far different picture from the prior eight years, which saw 115 increases in taxes and fees."
Real,Says Bruce Springsteen played in 1975 at Seton Hall University in South Orange at Walsh gym.
Real,"Says ""a Republican hasn't won [an election] for a presidency in New Jersey since 1988."""
Real,We created as many jobs in the first six months of this year as we did in all of 2011 and 2011 was the best single year for private-sector job growth since the year 2000.
Real,"If you look at most of the polls, this is a margin-of-error race on Fourth of July between Mitt Romney and the president."
Real,We are coming up on our 40th anniversary of electing a Republican to the United States Senate. 1972 was the last time New Jersey sent a Republican to the United States Senate.
Real,"To get out of the (teachers) union, you pay 85 percent of $731. Then you're out of the union, but you've got to pay it every year, also required by statute. Thats called a representation fee."
Real,"Says the proposed fiscal year 2013 budget ""is still below the level of state spending when I took office."""
Real,"Says the New York Giants ""train in New Jersey, they play in New Jersey and most of their players live in New Jersey."""
Real,"By the way, I'm not raising tolls 50 percent....Jon Corzine did."
Real,"And, as of today, New Jersey state government has less employees than when Christie Whitman left office in 2001."
Real,"Says ""over the last 48 years, every governor at the midterm of his first term or her first term has lost seats in the Legislature, with the exception of Jim McGreevey in 2003."""
Real,"Says judges ""get better benefits at a lower cost than everybody else in the state."""
Real,Says car insurance rates have decreased since about a decade ago because of market-based solutions that attracted more auto insurers to New Jersey.
Real,"In the entire public school system in Camden last year, only three students graduated college ready."
Real,"Today, our unemployment rate is 7.8 percent. That is the lowest in five years."
Real,"Given how expansive our program already was, expanding Medicaid in New Jersey due to Obamacare ""was a relatively small expansion."""
Real,"Says Barbara Buono ""voted to raise her own pay 40 percent."""
Real,"Four balanced budgets in a row, with no new taxes for anyone. The best job growth in 12 years. Nearly 130,000 new private-sector jobs. Merit pay to reward New Jerseys best teachers, and the most education funding ever."
Real,"Were spending less money today, in upcoming fiscal year 2014 than the Corzine-Buono budget spent in fiscal year 2008."
Real,"Since January 2010, New Jersey has added 103,000 new private sector jobs. The last two years -- 2011 and 2012 -- have been the best two years of private sector job growth since 1999."
Real,Property taxes had increased 70 percent in the previous 10 years.
Real,"Says ""on the state level, we spend less today than Jon Corzine spent in fiscal year 2008, five years later."""
Real,"Says New Jersey is ""50th in return of our federal tax dollars."""
Real,"Now remember, property taxes went up 70 percent in the 10 years before I became governor."
Real,"There has been ""$5 trillion in debt added over the last four years."""
Real,"Says Jon Corzine ""gave away 14 percent raises over 4 years and he stood on the front steps of the Capitol at a public-sector union rally and said, 'I will fight to get you a great contract."""
Real,"Says state Sen. Paul Sarlo ""said in February on NJTV, there will be no tax increases in this budget"" and ""voted the other night in the Senate Budget Committee to raise income taxes $800 million."""
Real,"New Jersey has the second highest rate of institutionalization of people with developmental disabilities ""in America. Only Texas puts more of its citizens -- confines more of its citizens -- to institutions than New Jersey. """
Real,"They say teachers only make on averagein New Jersey 60,000 dollars a year.They only work 180 days."
Real,"Says ""out of 588 school districts, we give 31 (former Abbott) districts 70 percent of the aid."""
Real,The water quality in the ocean is perfect. Its been tested up and down every ocean shore in New Jersey.
Real,"Out of 150,000 tenured teachers in the last 10 years, only 17 have been dismissed for incompetence."
Real,"Our small staff of 51 is still fewer than we had a decade ago, yet our caseload -- like that of other courts -- has grown."
Real,The Cathedral of Christ the King is one of the Archdiocese of Atlantas largest and fastest-growing parishes.
Real,Ken Buck's (District Attorney's) office? His spending skyrocketed by 40 percent.
Real,"California Republican gubernatorial hopeful Meg Whitman ""contributed to, and campaigned, for"" Democratic Sen. Barbara Boxer."
Real,Wind powers nearly 13 million homes across the country.
Real,"On foreign policy, Joe Biden was against aid for Vietnam, said the fall of the Shah was ""a step forward"" for human rights in Iran, opposed Reagan's defense build-up and voted against the first Gulf War."
Real,The video doesn't show the broader picture of the firing that was going on at American troops.
Real,We are one of only two states to have eight consecutive months of declining unemployment. Twenty-one states had increased unemployment last month. Ours went down.
Real,"Says Ohios economic recovery ""started in February 2010."""
Real,"In 2009, the Small Business & Entrepreneurship Council ranked Ohio 11th in the nation and 1st in the Midwest for overall business climate."
Real,Ohios electricity rates are 10 percent below the national average.
