text,labels
"""I'm not going to lose one minute of sleep ruining this two party monopoly that is going on,"" Gary Johnson said. | AP Photo Libertarian candidates: We will alter course of the election

Despite not making it to the first debate stage, both parts of the Libertarian ticket agree they are ""going to alter the course of this election whether or not we're in the debates.""

Last week, it was determined that Libertarian candidate Gary Johnson and Green Party candidate Jill Stein did not make the cut for the first presidential debate, which will be held Sept. 26. Despite that, on Sunday in an interview that aired on ""60 Minutes,"" Johnson and running mate William Weld agreed with interviewer Steve Kroft that their ticket still has the ability to make an impact.

Story Continued Below

Johnson said 70 percent of America do not know either him or Weld. At the end of the day, the former New Mexico governor said the Libertarian ticket is taking votes from both Democratic nominee Hillary Clinton and Republican nominee Donald Trump.

""This is both sides, man, this is both barrels,"" Johnson said on the CBS news program. ""I'm not going to lose one minute of sleep ruining this two party monopoly that is going on. I think they are dinosaurs and I think we're the comet in this whole equation. I'm glad for it.""

For his part, Weld said he thought their ticket would hurt Trump more. ""I think at the end of the day, it would be most likely Trump than Clinton,"" the former Massachusetts's governor said.

Johnson also acknowledged his recent gaffe, where he could not identify what the Syrian city of Aleppo was. He said there is no quicker way to fix mistakes than acknowledging them in the first place.

""I am human, I have a filter, it starts with honesty, it starts with the truth. When I was asked the question, the first thing that came to my mind is this is an acronym,"" Johnson said. ""You know so many people have said 90 percent of American doesn't know Aleppo, well 90 percent of America is not running for president of the United States. No excuse, no excuse.""

Authors:",real
"
Hillary Clinton didn't hold back in her attacks on Donald Trump Monday night, but Donald Trump intimated that he pulled a key punch — passing on making a reference to Bill Clinton's past infidelities.

“I was going to say something extremely rough to Hillary, to her family, and I said to myself, I can't do it,” Trump said in reply. “It's inappropriate. It's not nice.”

Story Continued Below

Trump's veiled reference followed a tough attack from Clinton, who referenced his past comments about women being “pigs” and “dogs” and said Trump “loves hanging around beauty contests” during Monday night’s debate.

“He tried to switch from looks to stamina. But this is a man who has called women pigs, slobs and dogs,” Clinton said.

Trump also said that Clinton has been hitting him “with tremendous commercials. Some of it's in entertainment.” Trump added that Rosie O’Donnell, the focus of some of his comments has “been very tough to me.”

Clinton has spent “hundreds of millions of dollars on negative ads ... many of which are untrue, and they're misrepresentations, and I will tell you this, Lester, it's not nice, and I don't deserve that, but it's certainly not a nice thing that she's done,” Trump added.

“I’m very happy that I was able to hold back on the indiscretions with respect to Bill Clinton,” Trump told reporters after the debate. “Because I have a lot of respect for Chelsea Clinton and I just didn’t want to say what I was going to say.”

And what exactly, a reporter asked, was that going to be?

“I’ll tell you maybe at the next debate, we’ll see,” he responded.

Authors:",real
"Three women who all went missing in the mid-1970s have turned up, at least parts of them, in a steel industrial 55-gallon drum buried on the Clinton estate in Chappaqua, New York. The barrel, which contained the arms, legs and heads of the three women, was filled with what the medical examiner calls a “crude preservative.”

That means that whoever put them in there wanted to be able to visit them later. Investigators were hoping to find the torsos in the second barrel recovered but found nothing but women’s shoes inside, all brand new in boxes withy the tags still on them. One investigator called it “the weirdest thing he’s ever seen.”

The three women, all of whom were in their late teens or early 20s, were hitchhiking their way from California to New York in 1974 when they disappeared. Their last known location before heading back onto the road was a motel just outside of Little Rock.

Is it a coincidence that three pretty young girls who disappeared so long ago from Arkansas ended up dead and buried on a property in upstate New York? It does if you talk to the Clintons PR people:

“Bill and Hillary Clinton have nothing to do with this and welcome any investigation with open arms. They have offered the DOJ their full cooperation. You people and your conspiracy theories that everyone who dies in America must have had a run-in with Hillary or Bill Clinton need to sit down.”

Investigators say while they don’t yet have enough to charge Bill Clinton, they certainly have enough evidence to question him. When they approached the house to do their jobs, they were met by a team of lawyers and Secret Service personnel and told that unless they have some real evidence, Mr. Clinton was unavailable.

They added that he felt really bad for those girls but hoped at least now their families have closure. Clinton will use ignorance and the 5th amendment to once again try to get away with murder.",fake
"The Republican war on women continues unabated. The same week that conservatives argued in the Supreme Court that employers should be able to stop their employees from getting contraception outside of the company health plan, Indiana joined the ranks of states like Texas and Florida in passing a draconian law that purports to protect women, while in fact, endangering their health by making safe abortion much harder to get. And Gov. Mike Pence recently signed it. The bill is stuffed with as many asinine restrictions on abortion with an eye towards making abortion as miserable and humiliating an experience as possible, and ideally something women can’t get legally at all.

Asked to comment on his approval of a piece of legislation that basically promotes hatred towards women once stripped of all the legal terms, Pence argued in an interview with The Huffington Post that “abortion as such was a mistake since the day it was first invented.” “So, let’s get that straight right away – I oppose abortion for any reason whatsoever because I believe that killing someone, or something, if you will, that hasn’t developed a consciousness just yet is the ultimate act of crime. And if we’re murderers of innocent beings who can’t defend themselves, how are we to expect people with a fully developed consciousness to stop murdering each other?” the Indiana governor said.

“And as if that wasn’t enough,” Pence continued, “we’ve got this situation now throughout different states where some lawmakers allow abortion under some circumstances like rape or when the fetus is diagnosed with an illness, and others just flat out prohibit it. And that’s bad for a number of reasons. First and foremost – we can’t have this kind of freedom of choice. This is bad, let’s be clear. And that’s part of the reason why I signed this bill, because I believe abortion, or I’m going to flat out call it murder, this murdering of children has to stop and it has to be prohibited in every state. So Indiana is just a step in the right direction.”

Pence also tried to offer his opinion on what would have happened had he allowed rape victims to still have abortion. “First and foremost, because this is such a sensitive topic, let me just say that I sympathize with rape victims not just in America, but around the world. I can only imagine what it must be like to experience such trauma,” he said. “However, that does not justify murder, not even that justifies murdering a baby, not in my book. Because what would happen? We’d then have an epidemic of women claiming to have been raped just so they could have an abortion. And that has to be stopped at all cost.”

Donald Trump’s new running mate also said, “Basically, if I’d have said no on the bill, that would be just like giving out get-pregnant-without-fear cards, because at the end of the day, women could have unprotected sex without worrying about what they’d do in the event of pregnancy. And you know, it’s not supposed to be like that. That would be equal to me picking up a butcher’s knife and slicing people open in the middle of the street. That would be murder. And I’m not a murderer.”

“And it gets worse – when you get an abortion, you get several days off of work and whatnot to recover. And there are a lot of crazy people out there. What if women would go out and get raped on purpose just so they could get off work? I mean, Indiana’s economy is struggling as it is, and having thousands of women absent from their jobs would be horrific for the state, I’m telling you. I made the right call and that will be confirmed in the long run,” Pence concluded.",fake
"As my 25th wedding anniversary approached, I tried to be creative in buying gifts for my wife. I had the idea of a silver coin that marked 25 years of something or other. I went to a local coin shop, and as I idled over some of the display cases, I noticed a set of coins from the mid-19th century. Oddly, the coins from the 1840s and 1850s were large—up until 1857, when the coins started becoming, at best, half the size of the others.

“Oh, the Panic of 1857,” the owner said when I asked him about the change of size. “It was really bad. The president didn’t seem to have any solution except to use less gold or silver in the coins.”

Story Continued Below

Now that is inept presidential decision-making. During the current election campaign, there has been a lot of gnashing of teeth over the possibility that—whoever the winner is—he or she will be so terrible as a leader they will bring down the republic as the worst president since independence. And before the current candidates were known, the two most recent White House occupants, Barack Obama and George W. Bush, have been consistently reviled by their detractors as the worst men to lead the country.

But Obama and Bush can both take heart. And Donald Trump and Hillary Clinton can gain solace, perhaps, from knowing that no matter how badly they do, they almost certainly won’t rank last. By my reckoning, that place belongs to James Buchanan, genial a man though he was. I’ve made quite a study of him. My innocent encounter at the coin shop only reinforced my lifelong determination to take an offbeat look at, let’s say, the lesser presidents. My father was definitely the only one in our suburban neighborhood with a biography of Franklin Pierce. Everywhere we went, he forced me to read historical plaques—stopping the car in a shrieking halt at times to view them. If I were to write a book about a president, it surely wouldn’t be about Washington or Lincoln, or even Silent Cal Coolidge. It would have to be about someone as ineffectual as possible.

Buchanan, the only president from my native state, Pennsylvania, turned out to be my man.

Start with his anemic, minimalist solution to one of America’s great financial downturns.

For a long time before Buchanan, in effect, precipitated the Panic of 1857, things were going well for the country, at least in an economic sense. There had been a bad downturn 20 years before, with multiple causes, like war in Europe, the dissolution of the Bank of the United States, and overspeculation in, oddly enough, slaves and Western land. The great acquisition of land under President James Knox Polk, from Oregon to California to Texas, reinvigorated the economy, and a boom lasted for the next two decades. Railroads were the big player, since so many people wanted to move West into the new territories and states. Manufacturing boomed domestically, and then with foreign trade as well, since Europe had quelled many of its hostilities and American items were cheaper than those on the Continent.

Then the day before Buchanan took office, Congress passed what he wanted, the Tariff Bill of 1857, which lowered tariffs on a panoply of items from abroad—Buchanan wanted to stimulate foreign trade—but made American manufactured goods of the same sort less competitive.

Three days later came the real fatal blow, though, the Dred Scott Supreme Court decision, which fell on the shoulders of Buchanan. The case had wound through state and federal courts for at least a decade, but Roger Taney, the Supreme Court chief justice, and a fellow alumnus, with Buchanan, of small Dickinson College, wanted it settled.

Scott was a slave to a military man who at times was stationed not in his native Missouri, a slave state, but in the Northwest Territories, which were nonslave. After his master died, Scott brought the case that he should be free because he had lived in nonslave territory. Buchanan wanted to be a hero, and thought if the case could be decided broadly, it could settle the question of slavery in the Union for good.

Buchanan knew, too, though, that the court had five Southerners and four Northerners, and if the decision were split that way, it would be ineffective. He and Taney had apparently agreed to have a narrower decision, or remand the case back to the Appeals Court, if it were merely sectional, since they felt the need to have some sort of bipartisanship for the decision to be legitimate.

Ignoring the idea of separation of powers, though, Buchanan browbeat Robert Cooper Grier, another Dickinson alumnus and a justice from Pennsylvania, to go along with the majority opinion, which Taney would write. Eventually, a New York native, Justice Samuel Nelson, wrote a concurring opinion, making the vote even less sectional.

Legend has it that Taney, on the Capitol stairs just before he gave Buchanan the oath of office at the inauguration, told Buchanan that the decision would become public in the next few days. Buchanan apparently changed his speech to indicate that—and that he would be all for whatever the court decided.

Two days later, the decision came down. Taney castigated Scott, whom he said was not a citizen, being a slave, and thus could not bring any suit. He also wrote that the Constitution gave no state or territory the power to institute or, conversely, prohibit slavery. Thus all the compromises about it, going back to the 1820s, were invalid, and, in fact, the Fugitive Slave Law, requiring anyone who knew about it to return slaves to their owners anywhere in the country, was in force.

Historically, experts rate Dred Scott as the worst decision in the court’s history, but short of that, it was at the very least transformational for the country—with not just Taney, but surely Buchanan, responsible for it.

As appalled as most of the country was about the morals of the decision at the time, there was a practical downside, too. Now no one knew whether he or she wanted to go West, to use the railroads, or to start a business that railroads might profit from. Railroad stocks started to decline in value, and then a contagion hit, and it was free fall. By midsummer, no one could take a ride on the Reading, as Uncle Pennybags does in the Monopoly game, since the Reading Railroad had shut down, as did lines now and then famous like the Illinois Central. Several lines, like the Delaware, Lackawanna and Western and the Fond du Lac Railroad in Wisconsin, declared bankruptcy.

Thousands were thrown out of work, and banks started foreclosing on loans and property. Senator William Seward, the leader of the new Republican Party, come home from a vacation to find out he had lost most everything he owned—his stock in the Illinois Central, promoted to him by his rival Democrat Stephen Douglas, was virtually worthless.

Every bank in New York City effectively closed—none would convert coins or gold into bank notes. The oldest grain company in New York, N.H. Wolfe and Co., failed in August, as did the most prominent insurance business in the country, the Ohio Life Insurance and Trust Co.

Buchanan and his administration did nothing to stem the public hysteria. Calm words might have quelled it, but his inaction only made for further runs on banks and, thus, more turmoil in markets.

The residue that mattered most, though, was the reaction caused by Dred Scott. Instead of promoting unity and opening up the West to more settlement, as Buchanan had thought, Dred Scott thwarted it, and brought an end to years of Northern prosperity.

Yet the South did not succumb as badly. Its agrarian culture was self-sustaining, and its cotton still had a market in Europe. There was a surge in arms sales there as well, the economic downturn in the North exacerbating regional tensions. The relative good times in the South caused Northerners of all parties to further blame Buchanan for being a Southern lackey.

Buchanan’s response was underwhelming, almost disdainful. He said the federal government could do nothing. In his Annual Message in December 1857, he said he sympathized with the travails caused by the Panic, but he would do nothing for individual suffering. The government would continue to pay its obligations and would keep going on whatever public works projects it had started, but would begin no new ones. He said too many people had speculated in land and slaves and the like and “deserved the gambler’s fate.” Eventually, he noted, the youth and energy of the rugged American individuals would triumph, though there would clearly be an interim of rough times.

In a sense, he was right, because it took the rugged young Americans who went to war in 1861 to bring the economy back.

Throughout his term, when a fork appeared in the road, Buchanan managed to take the wrong turn. When hostilities flared in Kansas, over whether that territory would enter as a slave or free state, Buchanan wavered over which of two proposed constitutions would be valid, exacerbating the killings, some done by the wild-eyed anti-slavery radical John Brown. When later Brown seized arms with a small cadre of followers in Harpers Ferry, West Virginia, just 40 miles from Washington along the Potomac, Buchanan again diddled before consulting Robert E. Lee, who had fortuitously been home in Arlington on leave from his post in Texas. Lee quickly went to Harpers Ferry to capture Brown and quell the raid.

In other ventures, though, Buchanan dashed troops out on strange and unproductive missions. He caused chaos in Utah, quelling what he thought to be a Mormon revolt, causing villages to be burned to the ground and dozens of lives lost over what was merely a jurisdictional dispute. He supported mercenary William Walker’s forays to conquer Nicaragua and Guatemala, and sent troops to try to annex parts of Paraguay, primarily to acquiesce to his Southern base that wanted more slave states to come into the union. Then there was the little known Pig War, started when a settler along the Canadian border on the San Juan straits in the Northwest, shot a pig owned by the Hudson Bay Co. that wandered onto his property. A standoff ensued until Buchanan sent troops otherwise guarding Kansas, where there was a real problem, out to calm the nonfatal—except to one pig—battle. This was at a time when there were about only 12,000 soldiers in the U.S. Army, stretched as thin as could be.

As the election of 1860 came close, Buchanan refused to support the one Democrat who could win, Stephen Douglas, because he just plain didn’t like him. That caused the party to split into three factions, each nominating a candidate, virtually ensuring Republican Abraham Lincoln the election.

The Southern states, which had threatened secession, started doing so during the interim between Lincoln’s election and his inauguration in March, thus under Buchanan’s watch. Buchanan took the unusual position that the Constitution did not allow secession, but the president could not do anything to prevent it.

As the first half-dozen states seceded, Buchanan lost several Cabinet members—he had a lot of Southern allies—and refused entreaties by many, including former President John Tyler, who would himself become a Confederate congressman, to find compromises to bring the wastrel states back into the fold.

Meanwhile, Buchanan allowed the seizure of armaments and forts by the seceding states and suggested the abandonment of the one major fortified island in the South, Fort Sumter.

Enter Lincoln, who has long been rated in serious surveys and schoolmarms’ speeches as the greatest of presidents. Lincoln no doubt was a man with plans and savvy, but I contend that the bar was set so low by his predecessor that maybe if there were no James Buchanan, the “Worst. President. Ever,” there would have been a few notches more on the presidential-rating scale for Abe Lincoln to climb.

Today, George W. Bush is often rated one of the worst presidents in history, thanks to his authorship of the Iraq War and his presiding over the Crash of ’08 and the beginning of the Great Recession. Obama is sometimes seen in the same light, especially by the far right. But as happened with Honest Abe and his predecessor, perhaps that low bar will only make it easier for a President Hillary Clinton or a President Donald Trump to shine.

Robert Strauss is author of the forthcoming Worst. President. Ever.: James Buchanan, the POTUS Rating Game, and the Legacy of the Least of the Lesser Presidents.",real
"It might be hard to believe, after all, many of us had used Vick VapoRub. It seems like a harmless ointment, effective for fever, nasal congestion, and many other affections.

But this case will make people question its use, especially moms and dads with small children because it could bring fatal consequences to them.

A Mexican mother tells her tragedy to warn other parents and avoid someone else going through what she’s living: the loss of her 2-years-old baby.

When she came back from work, she came into her baby’s room. When she got near to kiss him, she felt he had a fever. She imagined it was just a common cold and thought about a home remedy to relieve him.

She rubbed Vick VapoRub on his chest, back, and under his nose to help him breathe. She tucked him up and laid down next to him.

She was tired, so she fell asleep next to her baby. Hours later, when she woke up, she noticed her son wasn’t breathing.

She carried him and took it to the hospital to save him. But, sadly, everything was pointless, the baby had been dead for hours.

The medical report stated the child died due to inflammation in the respiratory track, produced by the camphor contained in the famous ointment.

She never imagined that home remedy would take his baby. She only wanted to help him breathe, and the ointment did exactly the opposite.

The thing is, this remedy is effective for adults; however, for babies younger than two years old, the ointment increases the mucus by 60%. The mucus accumulates on the trachea and blocks the breathing.

The label warns the ointment is contraindicated for children younger than 3 years old.

Sadly, in the case of the Mexican mother, the warning went unnoticed. Using home remedies for several affections is something common in homes around the world, but we hope this story draw attention to this fact: when children are concerned, we must always read the labels and ask for the advice of experts before using any home remedy.

We must not let a simple mistake take our loved ones; we must be careful and seek medical advice to treat any illness.",fake
