text,labels
"An anti-Donald Trump super PAC is going on the offensive ahead of the first presidential debate this Monday at Hofstra University in New York.

The group, the Not Who We Are campaign, is using students at the very university where the debate will be held to make a point. A new web ad produced by the group features students unfriendly to Trump's message.

“I don’t think you can have a racist bigot as president,” one student says in the 60-second spot that was filmed on campus.

Another chimes in, “He makes me terrified.”

And a third simply says, “I don’t want him on campus.”

The Not Who We Are campaign plans to run the ad on Twitter and Facebook ahead of and during Monday’s debate.

“Since the Donald himself is coming to campus, these Hofstra students are standing up and sending a message that bigotry and hatred are not who we as Americans and not who they are as part of the Hofstra community,” Not Who We Are’s campaign manager Josh Hendler said in a statement.

Hendler’s group bills itself as a venue for “community members and leaders across the country” to “organize their friends, neighbors and coworkers to take a stand against” Trump by writing open letters.

“We’ll help you craft the language and organize co-workers to take a stand against bigotry and hate,” the group’s website says.

The site features letters from companies, universities and groups ranging from members of the clergy to scientists to golfers.

One recent letter, written by Hofstra student Rob Bielunas, reads in part: ""As a community, Hofstra has worked to root out racism, sexism, and xenophobia, the very ideas Mr. Trump has used to get where he is today. His hateful rhetoric and complete disrespect for his fellow citizens are why we, as members of the Hofstra community, stand up against Donald J Trump’s run for president.""",real
"In the first half of the debate, Donald Trump seemed bogged down by some very distracting sniffles. After peddling for weeks a lucrative conspiracy that Hillary Clinton is too sick to be Commander-In-Chief, one must ask themselves why Trump couldn’t stop sniffling. Is he sick? Was he holding back tears (after being pummeled by Clinton)?

Howard Dean, former head of the DNC and presidential candidate, has a more unconventional answer: he was on drugs.

Dean, who is now a contributor for MSNBC, tweeted last night:

Notice Trump sniffing all the time. Coke user? — Howard Dean (@GovHowardDean) September 27, 2016

Trump supporters took to Twitter to express outrage, completely forgetting that their preferred candidate spent weeks fueling sexist attacks against Clinton and her stamina abilities. But hey, get offended when Dean points out what could be the obvious. After all, Trump did protect a cocaine trafficker from serving proper jail time by pulling some strings in the justice system.

And considering he hasn’t released any medical records, who knows what adverse effects drugs (if he does them) has done to his body and mental state.

Of course Trump denied he was sniffling, even though the rancid sounds were heard by millions of watchers across the country (and the globe) and the Republican nominee denies that he is sick. So that begs the question: what else could it be.

Dean’s assertion is just that — an assertion. It has no factual ground to stand on, but it is ironic to see how Trump supporters react when a conspiracy is made against their candidate. Perhaps they (and Trump) will think long and hard before trying to paint Clinton as anything she’s not.

If this debate showed one thing, it’s that Hillary came out on top and Trump is not happy about it. Why not have a little fun at his petulant behavior? Howard Dean is.

Featured image via Joe Readle/Getty Images",real
"Republican nominee Donald Trump’s Ohio chairwoman recently took it upon herself to prove to the world just how delusional the right-wing in America really is when Kathy Miller told reporters that racism in America didn’t exist until President Obama. “I don’t think there was any racism until Obama got elected. We never had problems like this … Now, with the people with the guns, and shooting up neighborhoods, and not being responsible citizens, that’s a big change, and I think that’s the philosophy that Obama has perpetuated on America. Growing up as a kid, there was no racism, believe me. We were just all kids going to school.”

This perfectly illustrates how the right-wing digs their mental bogs of ignorance – blame Obama for literally everything; absolve self/race/identity group of all responsibility, then construct pleasant fantasy.

Supporting her candidate’s constant efforts to sabotage what little support he has within the African-American community, she then went on to say that black Americans are responsible for the decades of their socioeconomic disenfranchisement by saying that “if you’re black and you haven’t been successful in the last 50 years, it’s your own fault. You’ve had every opportunity, it was given to you. You’ve had the same schools everybody else went to. You had benefits to go to college that white kids didn’t have. You had all the advantages and didn’t take advantage of it. It’s not our fault, certainly.”

To put a big white cherry on this perverse cake of racism, she then felt the need to add that “the Black Lives Matter movement is a stupid waste of time” and that low voter turnout is probably related to how black Americans “were raised.”

In one fell swoop, this woman has erased four hundred years of slavery, segregation and the Jim Crow era, the widespread lynchings of black Americans by radical Christian terrorist organizations like the Ku Klux Klan, the ghettoization of the inner cities, mass incarceration and the War On Drugs, and the wholesale slaughter of black Americans by law enforcement from the record. Instead, she is blaming the only black president our nation has ever had, when in reality it was his election that brought all the racism to the surface.

She is echoing sentiments shared by a large portion of the American population which has been either brainwashed by media narratives or too ignorant know any better, but it shows just how large a divide we face in try to engage with people so entirely divorced from reality. When the daft old woman was informed that this might sound offensive to some people, she replied “I don’t care, it’s the truth.”

The Trump campaign in a nutshell, ladies and gentlemen.

UPDATE: Kathy Miller has resigned her from her position with the Trump campaign and has issued an apology. It should be noted the Trump campaign has yet to apologize for anything this campaign season.

Watch it here – her remarks begin at 4:40:

Add your name to millions demanding that Congress take action on the President’s crimes. IMPEACH DONALD TRUMP!",real
"McCain Criticized Trump for Arpaio’s Pardon… Sheriff Joe Fires Perfect Response Joe Arpaio may not be in office any more, but that doesn't mean America's toughest sheriff has lost his step... check out how he eviscerated John McCain after McCain attacked Donald J. Trump for pardoning the Arizona lawman. Read more…",real
"Rasheed Thompson, 39 of Chicago, was arrested in connection with a series of dead bodies found in a freezer located in his basement. According to reports, the bodies had the words “Black Lives Matter” carved into the foreheads of the corpses.

The Chicago coroners office made a gruesome discovery today after several 911 calls were placed by neighbors regarding their concern of suspicious activity at the residence of Thompson. At approximately 8 p.m., police were dispatched to South Pulaski Road and West Lexington Street. Upon their arrival, their arrival, authorities were met by a group of residents at the corner where they assisted police in locating the home in question. Police proceeded to the 3000 Block of West Lexington Street where they located the home. Authorities knocked on the door of the residence and was met by an African-American male, who appeared to be in his late 30’s and seemed to be “under the influence of drugs”.

Upon entering the home, authorities indicated that the home “smelled of death”. The power was off in the house however authorities found a gasoline powered generated running in the kitchen.

“A Black male, approximately in his 30’s, opened the door with the smell of alcohol and marijuana on his body. He appeared to be somewhat disoriented and his speech was slurred. We asked him for permission to enter the premises, however he seems reluctant to allow us to enter,” said Lt. Kyle Jennings. “After a few seconds, he mumbled “yes” to us. Once we entered the home, we were met with a very foul odor as if something was dead in the home. The power was off so we used our flash lights to look around. As we approached the rear of the home, a light was on in the kitchen. We asked the occupant for his name. He identified himself and told us he lived with his grandmother. In the kitchen, we found several handsaws covered in blood. Mr. Thompson pushed one of the officers and ran downstairs through a half-opened door in the kitchen.”



Rasheed Thompson, 39 of Chicago, was arrested in connection with a series of dead bodies found in a freezer located in his basement. According to reports, the bodies had the words “Black Lives Matter” carved into the foreheads of the corpses.

The Chicago coroners office made a gruesome discovery today after several 911 calls were placed by neighbors regarding their concern of suspicious activity at the residence of Thompson. At approximately 8 p.m., police were dispatched to South Pulaski Road and West Lexington Street. Upon their arrival, their arrival, authorities were met by a group of residents at the corner where they assisted police in locating the home in question. Police proceeded to the 3000 Block of West Lexington Street where they located the home. Authorities knocked on the door of the residence and was met by an African-American male, who appeared to be in his late 30’s and seemed to be “under the influence of drugs”.

Upon entering the home, authorities indicated that the home “smelled of death”. The power was off in the house however authorities found a gasoline powered generated running in the kitchen.

“A Black male, approximately in his 30’s, opened the door with the smell of alcohol and marijuana on his body. He appeared to be somewhat disoriented and his speech was slurred. We asked him for permission to enter the premises, however he seems reluctant to allow us to enter,” said Lt. Kyle Jennings. “After a few seconds, he mumbled “yes” to us. Once we entered the home, we were met with a very foul odor as if something was dead in the home. The power was off so we used our flash lights to look around. As we approached the rear of the home, a light was on in the kitchen. We asked the occupant for his name. He identified himself and told us he lived with his grandmother. In the kitchen, we found several handsaws covered in blood. Mr. Thompson pushed one of the officers and ran downstairs through a half-opened door in the kitchen.”

Lt. Jennings and two other officers chased Thompson down the stairs which is where the foul odor had gotten stronger. When the officers got to the basement, they found a series of freezers scattered around the basement. With no trace of Thompson, one officer continued to search for him as the other two pried opened three locked deep freezers. Upon their discovery, 11 decapitated bodies were found frozen, while the heads where in ziplock freezer bags. All of the bodies appeared to have been Caucasian women, possibly in their early to mid-20’s. The heads that were found all had the words “Black Lives Matter” carved into the foreheads. The bodies were were preserved, possibly from being stored in the deep freezers.

The police radioed for back up and the other freezers were opened where 8 more bodies in similar condition were found, however one of the women was still alive. Authorities at the scene helped the woman out of the freezer and waited for paramedics to arrive.

“I was kidnapped by this Black guy after I left work earlier today. We talked for while at Starbucks, where I work, before everything happened. At first he seemed pretty nice but he had this weird twitch that happened every couple of minutes. He asked if he could walk me to my car and I said yes, but that is when everything went dark. When I woke up, I was in this basement and I saw that guy I was with earlier taking saws up the stairs. I cried for help and that is when he stuffed me into a freezer where I saw dead bodies. I must have passed out from shock or something but I am happy you guys found me,” said to police by the victim.

Officer Douglas, who was searching for Thompson, found him in a crawl space in the basement. Police ran a background check on him and discovered that he was arrested during a protest for the police involved shooting death of Laquan McDonald. Thompson had no prior criminal record according to authorities.

The names of the victims have not been released. Thompson was taken into custody by police and had later tested positive for PCP which authorities believe may have lead to Thompson’s crimes.",fake
"A 10-year-old boy who had eaten a banana his mother purchased at a Walmart in Tulsa, Oklahoma, was rushed to the emergency room due to fever, chills and fatigue just seven days after consumption. After a thorough examination, blood tests and scans the young boy tested positive for the HIV virus. His mother obviously in shock. However, the 10-year-old child was not the only one admitted to the hospital for the same issue. Eight children, all under the age of 17, have been diagnosed as HIV-positive within the month of March. What is the one thing they have in common? Purchasing bananas from The Tulsa, Oklahoma Walmart.

According to the parents, they submitted several foods their children had been eating to doctors for testing, along with documenting the different places they had visited within the month. They found that all 8 children had consumed bananas from the superstore. The facility, LHC Laboratories, tested the bananas which all came up positive containing the HIV virus. Researchers are still trying to understand how the virus could have entered the bananas, stayed active, and infected the children through consumption.
    In the meantime, bananas are being pulled off the shelves in Walmart stores across the United States. According to many media outlets, the CDC is encouraging Americans to discard any uneaten bananas and to contact your doctor if you experience any of the following symptoms:  
     Fever
     Chills
     Rash
     Night sweats
     Muscle aches
     Sore throat
     Fatigue
     Swollen lymph nodes
     Mouth sores
    These symptoms could be an indication that you have contracted the HIV virus and need to seek medical attention immediately.",fake
"Recently, Republican Ohio Gov. John Kasich vetoed the so-called “heartbeat bill,” a measure that would have banned all abortions after about six weeks of pregnancy, or before many women even know that they are pregnant. At the same time, Kasich signed a bill banning abortion after 20 weeks of pregnancy, with exceptions only for saving a pregnant woman’s life or preventing the “substantial and irreversible impairment of a major bodily function.”

“At the risk of sounding discriminatory, which is not at all my goal here, but at the risk of sounding like that, there is no way women should be allowed control over whether or not they are going to have abortions,” Kasich told the Ohio Daily Star. “Women are wonderful beings, they are kind, loving, incredible and a whole other plethora of adjectives could be used to describe them, but at the end of the day, I’m sorry to have to say this, but the honest truth is that women used to be all those things. The women of today are mainly opportunists and gold diggers, who typically get pregnant due to unsafe sex, or to get their partners to marry them.”

He continued, “Our mothers and women of the old times were the women every man deserved and was blessed to have. Today, the situation is so critical that I honestly fear for the future of this country. And so, I was in a position to make a change and do something important, and so I did. And there’s one very simple reason why I did it. That’s that, if a woman these days is not intelligent enough to keep her legs closed when they’re supposed to be closed, if she doesn’t have the foresight to make sure she doesn’t get herself in a situation where she might be pregnant, then there is no way a woman like that can or should be entrusted with the decision of having an abortion.”

“A woman like that can barely take care of herself, and we’re supposed to tell our doctors to perform an abortion on such a woman and kill her unborn child – a being who’s done no wrong and only exists as its mother’s mistake? Do you really want to put the men and women in our healthcare in that kind of situations? To literally force them to commit manslaughter?” Kasich said. “I don’t know about the rest of the people living in my state, but I for one am not comfortable with that one bit. And so I reacted and did what was necessary to prevent that from happening.”

“And I’ll tell you another thing – as of recently, all cases of out-of-wedlock pregnancies in the state of Ohio will have to be approved by the state. That means that every single couple that becomes pregnant and isn’t married or at the very least engaged, will be scrutinized to determine whether the pregnancy was planned or accidental. And in the case of the latter, the couple will be fined a total of $100,000, with $70,000 of the fine being charged on the mother-to-be for not being able to not only use birth control, but having sex before marriage in the first place. Women in this country really need to learn to either keep their legs closed or their other orifices open,” the governor concluded.

Source:newslo.com",fake
"House Speaker Paul Ryan (R-WI) this week disputed reports that 22 million people would lose insurance under the Republican health care plan. During an interview that aired on Tuesday, Fox News host Brian Kilmeade asked Ryan to respond to a recent Congressional Budget Office (CBO) report that said there would be 22 million more people without health insurance by 2026 if the Senate’s version of the health care bill is signed into law. “What they are basically saying at the Congressional Budget Office, if you’re not going to force people to buy Obamacare, if you’re not going to force people to buy something they don’t want, then they won’t buy it,” the Speaker opined. “So, it’s not that people are getting pushed off a plan, it’s that people will choose not to buy something that they don’t like or want.”

Kilmeade then asked Ryan to comment on the fact that the Republican health care platform is going to make health insurance plans significantly less affordable by decreasing subsidies for poorer Americans. Ryan replied by ranting about how being poor is “a choice.” “This is something we’ve been over on more than once occasion,” Ryan said. “I know why you’re asking me this; you want me to feel guilty for depriving 22 million people of health insurance, right? Well, I’m sorry Brian, but it’s not working. And the reason why it’s not working is, you’re using the wrong logic here. You’re using the wrong logic alongside millions of other Americans, because all of you feel that those who get up every day and work hard for some reason owe something to those who just lie around doing nothing. That’s not right.”

“Why should anybody who has the willpower to tackle problems and obstacles in order to provide a good life for themselves and their family be obligated to set aside some of their hard earned money to help other people who don’t want to work hard and, instead, rely on policymakers to ensure they have welfare or, in this case, affordable health insurance?” Ryan opined. “The answer is – they shouldn’t. This is a land of opportunities; but, the thing is, to be able to capitalize on those opportunities, one has to be willing to work hard. And that’s the only condition, working hard. If you work your butt off every single day, you can afford whatever you want, including the best health insurance possible. Now we arrive at my ultimate point: if you choose to work hard, if that’s a choice you make every time you wake up in the morning, then this is something that guarantees your success. But, if you choose to be lazy all day and expect the government to take care of you, then you’re doomed.”

“Being rich or poor is a matter of choice; that’s all there is to it. So, let me ask you this, Brian: if 22 million people consciously make the choice to not work hard day in and day out, why on earth should the rest of us be concerned with whether or not they’re going to be healthy? If they choose to be poor, then it’s their own problem if they can’t afford to be healthy. Think of the message we’d be sending to poor people around the world by nurturing laziness and providing affordable healthcare to poor people. We’d be sending them an open invitation to come here and do nothing. ‘Just come on over and become a U.S. citizen – the government will get you free food, free shelter and free health insurance, and you don’t even have to get a job.’ That’s preposterous, anyone who thinks that’s a good thing deserves to be poor,” he concluded.",fake
"Story highlights Ahmad Khan Raham is alleged to have carried out the bombings

Some have said he should be tried as an ""enemy combatant"" rather than a US citizen

(CNN) The arrest of Ahmad Khan Rahami, the man suspected of Saturday's bombing in New York and explosion in New Jersey, is reviving a debate that's become familiar when American citizens are implicated in terrorism post-9/11: Whether or not they can be considered enemy combatants.

Sen. Lindsey Graham, R-South Carolina, and others have suggested that Rahami be detained by the military as an enemy combatant, in part so he would not have be read his Miranda rights.

Here are five common questions about terrorism suspects and the legal system:

1) Do U.S.-citizen terrorism suspects arrested within the United States have constitutional protections in the first place?

Yes. There are ongoing debates over the constitutional rights of non-citizens (and citizens traveling overseas), but the Supreme Court has never suggested that a US citizen arrested within the United States receives lesser constitutional protection simply because he's a terrorism suspect.

Read More",real
"80510 SHARES Facebook Twitter Reddit Stumbleupon Pinterest

Earlier this week, as part of an interview he gave to Fox News, Donald Trump announced he had just learned that Ford Motor Company was about to “fire all their employees in the United States and…move to Mexico.” Trump went on to add that when he becomes President, Ford would have to pay a 35 percent tax on any car they send back to the United States for sale.

Wow! That’s big news! It’s also, like 99.9 percent of what Donald Trump says, a gigantic lie, according to Ford CEO Mark Fields, who told CNN:

“It’s really unfortunate when politics get in the way of the facts.”

CNN host Poppy Harlow then asked Fields, would Ford cut any American jobs as part of its plans to build a new manufacturing plant in Mexico? To that, Fields replied:

“Absolutely not. Zero. Not one job will be lost. Most of our investment is here in the US. And that’s the way it will continue to be.”

Continue reading below the advertisement















Ford has 85,000 workers in the United States, and that number has risen by 50 percent over the last five years. It currently employs 8,800 people in Mexico, and the new plant will create 2,800 additional jobs there.

So once again we see that Donald Trump will say anything at all in order to muddy the waters and make it appear that he is the savior of the American economy. That’s a powerful message, especially in the industrial heartland–states like Michigan, Ohio, Pennsylvania, and Wisconsin–where Trump is hoping to score big on Election Day. But Trump has financially screwed over thousands of small businesses and vendors over the years to have any legitimate clout on the economic issue. All he offers is more tax cuts for the rich and empty words. And lies. Lots and lots of lies. Tax those and we could pay off the national debt.

Featured Image Via Business Trajectory

80510 SHARES Facebook Twitter Reddit Stumbleupon Pinterest",real
